Masculino,43.0,Nacional,Regular,3,21,"""Depressing, unusual attraction""","""Me doy cuenta de que muchas personas consideran que este museo de momias es una visita obligada. Francamente, lo encontré deprimente y triste. Mirar a las personas que murieron hace muchos años no es mi idea de un buen momento"".

La mejor parte de la visita fue un viaje en autobús local desde el área central de Guanajuato. Mezclarse con los lugareños siempre es una buena manera de sentirse parte de la cultura. Rápidamente queda claro que Guanajuato es una ciudad real con gente real, y no solo una atracción turística"".",México,Inglés,PC,2016-12-27,neutral
Masculino,28.0,Nacional,Excelente,5,3,"""Excelente""","""Un museo excelente, el personal de este es amable y atento y si cumplió con nuestras expectativas, gracias ello aprendimos más sobre este museo y los cuerpos exhibidos en el.""",México,Español,Móvil,2016-12-26,positivo
Femenino,36.0,Nacional,Excelente,5,16,"""No te hagas momia. Ve como se conservan estos cuerpos y algo mas de la ciudad""","""En vitrinas en un recorrido corto con breves explicaciones ya sea con visita guiada o por tu cuenta ve a ver como estos cuerpos se conservan naturalmente.Además no dejes de visitar minas y monumentos, además de museos y realizar una divertilla callejoneada cantando y bailando por el centro de Guanajuato en el corazón de México ven y visita esta magnífica ciudad.""",México,Español,PC,2016-12-26,positivo
Femenino,,Internacional,Excelente,5,5,"""Vacaciones""","""Un lugar que al principio empiezas a ver como algo sencillo, pero conforme vas avanzando y empiezas a observar los tipos de momias se empieza a poner la piel chinita, lo recomiendo.""",España,Español,Móvil,2016-12-25,positivo
Masculino,36.0,Nacional,Malo,2,32,"""Parada interesante pero de una sola vez""","""El lugar generalmente está lleno, está estrecho y no se permiten fotos con fallas y mucha gente lo hace, por lo que no hay control del lugar.""",México,Español,Móvil,2016-12-24,negativo
Masculino,33.0,Nacional,Regular,3,43,"""Si te sobra tiempo""","""Si eres mexicano es imposible no haber escuchado hablar de las momias de Guanajuato, el lugar no es malo pero tampoco es la gran cosa, Guanajuato es una ciudad hermosa con lugares muchísimo más interesante que ver, ir sólo si te sobra tiempo.""",México,Español,Móvil,2016-12-24,neutral
Femenino,31.0,Internacional,Excelente,5,3,"""Love it!""","""Puede haber algo un poco morboso en este lugar. ¡Pero para un historiador es genial! ¡Me encantó leer y escuchar la historia de las momias!""",Italia,Inglés,Móvil,2016-12-22,positivo
Femenino,33.0,Internacional,Excelente,5,83,"""Incredible - not for the squeamish""","""¡Un lugar interesante, donde puedes ver una momia natural! Las vitrinas de vidrio albergan las momias secas. Ves las momias naturales más altas, más viejas y más pequeñas. ¡Ves bebés momificados y una momia de una mujer que fue enterrada viva! Es un poco espeluznante, pero increíble y educativo. Afuera, puedes comprar adorables dulces con forma de momia, 4 por $70 pesos. Un video en español y un guía turístico explican cómo se secaron las momias. Simplemente debes darle una pequeña propina al guía turístico.
Inconvenientes:
Todo está en español.
Ligeramente espeluznante
El video no tiene subtítulos para hablantes de inglés
Grupos más grandes: las personas en la parte de atrás no pueden ver tan bien
Pantalla pequeña para ver videos.

En general, fue una experiencia increíble y la recomiendo totalmente"".",Vietnam,Inglés,Móvil,2016-12-22,positivo
Masculino,50.0,Internacional,Malo,2,7,"""Not worth the time""","""Nos tomó 5 minutos pasar por el museo, menos tiempo que hacer fila para comprar los boletos. ¿Necesito decir mucho más?""",Estados Unidos,Inglés,Móvil,2016-12-21,negativo
Femenino,39.0,Internacional,Regular,3,5,"""Disturbing""","""Pagamos 52 pesos para entrar a la exhibición de momias en Guanajuato. Las momias son interesantes, pero también incluye bebés momificados y el único feto momificado. Mi esposo explicó más tarde que estas 'momias' fueron extraídas de sus tumbas porque sus familias no pagaron a ellos.""",Estados Unidos,Inglés,Móvil,2016-12-21,neutral
Femenino,33.0,Internacional,Muy bueno,4,35,"""Shorter tour than I expected""","""La gira es muy interesante. Sin embargo, la multitud hizo que fuera un poco difícil escuchar todo lo que decía el chico de la gira. Hubiera preferido un grupo más pequeño. ¿Tal vez solo fuimos en un día lleno de gente? Además, si viaja con senior ciudadanos, pueden mostrar su identificación y obtener un descuento para personas mayores"".",Estados Unidos,Inglés,Móvil,2016-12-21,positivo
Femenino,32.0,Nacional,Muy bueno,4,3,"""Excelente visita""","""Saber un poco más de algo que identifica a esta bella ciudad. Muy interesante y recomendable. Y para que no les digan y no les cuenten, no dejen de visitarlas.""",México,Español,Móvil,2016-12-20,positivo
Masculino,39.0,Nacional,Excelente,5,14,"""El mejor de todos""","""Esta es una visita obligada a la ciudad de Guanajuato, ahí apreciarás verdaderas momias, que se formaron naturalmente, no fueron embalsamadas, es increíble como se llegan a deshidaratar los cuerpos humanos sin llegar a descomponerse, podrás observar la momia más pequeña del mundo. No debes perdértelo.""",México,Español,PC,2016-12-20,positivo
Femenino,42.0,Internacional,Excelente,5,13,"""¡Muy bueno!""","""Una atracción súper interesante para niños y adultos. Museo de la momias que no lo son técnicamente pero si son cadáveres deshidratos por un proceso único gracias al clima seco de la zona.""",Argentina,Español,PC,2016-12-20,positivo
Femenino,36.0,Internacional,Excelente,5,212,"""Fascinating!!!!""","""Realmente disfruté mirando estas momias. Fue espeluznante y funky e incluso un poco aterrador. Hay una momia de una mujer que fue enterrada viva, una de un hombre que se ahogó y otra de un hombre que fue apuñalado además del muchas otras momias que murieron por causas naturales. Hubo un par de momias de mujeres que probablemente eran bastante gordas y eso también fue interesante de ver"".",Turquía,Inglés,Móvil,2016-12-20,positivo
Masculino,,Nacional,Malo,2,7,"""Esperaba más""","""La verdad no vale mucho la pena, ya que dejaron muy pocas momias. 50 pesos aproximadamente y está carísimo por lo visto.""",México,Español,Móvil,2016-12-19,negativo
Femenino,37.0,Internacional,Excelente,5,185,"""A quién le gustan las momias, les gustará, no a los aficionados de la decepción de Jet""","""Si te gustan las momias de diferentes culturas y pueblos y quieres ver algo diferente de los cuerpos embalsamados, te gustará este pequeño museo con sus habitantes locales momificados (a excepción de las momias de otras exhibiciones). No da miedo, hay alumnos en grupos, no tienen miedo. Si no te gusta ver esto, no te vayas, no me arrepiento de haber ido, estaba interesante.""",Bielorrusia,Ruso,PC,2016-12-17,positivo
Femenino,40.0,Internacional,Regular,3,9,"""No era lo que me imaginaba""","""No me gustó mucho la experiencia, el museo es más pequeño huele a moho , y las momias impactan por sus expresiones de dolor al momento de su muerte.""",Bolivia,Español,Móvil,2016-12-17,neutral
Femenino,21.0,Internacional,Excelente,5,20,"""¡Tienes que visitarlo!""","""Es muy llamativo este museo por que todavía consevan las momias en buen estado. Si eres estudiante te dan un descuento para entrar al museo. vale la pena ir por que te muestran las historias de las momias.""",Perú,Español,Móvil,2016-12-16,positivo
Masculino,25.0,Nacional,Pésimo,1,79,"""Horrible""","""No entiendo por qué tal lugar puede ser un lugar turístico. Los empleados tienen una actitud pésima, creo que es porque llevan tanto tiempo con las momias. Momia no es cultura, es algo horrible. No recomiendo a nadie visitarlo.""",México,Español,PC,2016-12-15,negativo
Masculino,20.0,Nacional,Muy bueno,4,7,"""Algo nuevo""","""Es algo impactante el tema de las momias porque uno se imagina algo distinto, el museo es excelente, la información, la ambientación, el único detalle es que es un recorrido muy corto, no sé si tengan más de donde crecerle pero a mí gusto trataría de distribuir las momias de manera que no hayan partes del museo donde este saturado de los ejemplares.""",México,Español,Móvil,2016-12-14,positivo
Femenino,39.0,Internacional,Muy bueno,4,11,"""Tradición y cultura""","""Incríible la conservación en dichos cuerpos con historias muy interesantes cada una de ellas. Tienen que conocer este museo es una experiencia que no se olvida.""",Nicaragua,Español,PC,2016-12-14,positivo
Femenino,41.0,Internacional,Muy bueno,4,5,"""Creepy experience""","""En general, fue muy interesante pero triste al mismo tiempo. Lo visité por curiosidad, pero terminé sintiendo que había violado la privacidad de alguien"".",Estados Unidos,Inglés,PC,2016-12-14,positivo
Masculino,42.0,Internacional,Muy bueno,4,164,"""One of a kind attraction!""","""Esta fue una visita de regreso para mí. El lugar ha mejorado desde que fui por primera vez hace unos 15 años. Las momias ahora están bajo vidrio, protegidas. También encontré más información esta vez, en inglés y español. En mi último año entré por solo 17 pesos, una verdadera ganga!""",Estados Unidos,Inglés,PC,2016-12-12,positivo
Femenino,27.0,Internacional,Regular,3,21,"""Dejó mucho que desear""","""Esperaba más, si bien es cierto que es una de las atracciones principales deberían de he charle más ganas, el precio es mucho para lo que ves, no me quita nada si no pasó a verlo.""",Costa Rica,Español,Móvil,2016-12-11,neutral
Femenino,22.0,Nacional,Regular,3,9,"""Visita""","""Muy elevado el precio para la exposición. Los guías más que pedir propinas. Es colaboracion a fuerza.""",México,Español,Móvil,2016-12-11,neutral
Masculino,43.0,Nacional,Muy bueno,4,18,"""Impresionante""","""La exposición de los cuerpos es impresionante e indescriptible cuando los estas apreciando, el lugar nada fuera de lo común.""",México,Español,PC,2016-12-10,positivo
Femenino,40.0,Internacional,Pésimo,1,8,"""Horrible y de mal gusto""","""Las momias del museo no cuentan una historia, sufrieron el proceso de momificación al azar, y el museo no explica lo suficiente. Para mí, pareció sólo una experiencia sádica y de mal gusto. No recomiendo.""",Portugal,Portugués,Móvil,2016-12-08,negativo
Masculino,51.0,Internacional,Muy bueno,4,52,"""Interesante e imperdible""","""Si vas a Guanajuato tienes que visitarlo, es muy concurrido así que se paciente y tolerante pero puedes irte solo, deja pasar a los grupos grandes y disfrútalo. Es un sitio que no puedes dejar de visitar en esta ciudad.""",Bolivia,Español,Móvil,2016-12-08,positivo
Femenino,28.0,Internacional,Excelente,5,51,"""Interesting""","""Momias macabras pero interesantes y bien conservadas. Las momias/esqueletos estaban todos arreglados y exhibidos bien en gabinetes de vidrio iluminados. ¡¡La exposición está bien hecha!!""",España,Inglés,Móvil,2016-12-08,positivo
Femenino,,Internacional,Regular,3,306,"""Short for the amount pay""","""Pero como estaba allí por el Día de Muertos, decidí hacerlo. Fue un poco espeluznante cómo decidieron mostrar momias al azar con las que se tropezaron. Los bebés fueron particularmente desgarradores"".",Estados Unidos,Inglés,PC,2016-12-07,neutral
Femenino,43.0,Internacional,Excelente,5,16,"""Yes, go see it""","""Pero es súper extraño que estén usando cadáveres modernos como museo. Dejaría ir a mis hijos, pero entiendo por qué algunas personas no querrían que sus hijos vieran cadáveres con caras de miedo. Sin embargo, mi esposo y yo realmente disfrutamos esto"". """,Estados Unidos,Inglés,Móvil,2016-12-07,positivo
Femenino,36.0,Internacional,Excelente,5,83,"""Interesante""","""Lugar muy bien conservado. Excelente la limpieza. Es una visita obligada. A los niños les encantara.""",Argentina,Español,PC,2016-12-06,positivo
Masculino,40.0,Nacional,Excelente,5,23,"""Tienen que pasar a visitarlo""","""Aunque afuera hay mucha gente ofreciendo sus servicios para dar un tour, no se recomienda, son muy agresivos y enfadosos. El museo cuenta con personas certificadas que tienen el conocimiento para compartirles y hacerles pasar un momento agradable. Vale la pena la visita, dura aproximadamente 20 minutos y aclara muchos mitos sobre las momias.""",México,Español,PC,2016-12-05,positivo
Masculino,60.0,Nacional,Excelente,5,25,"""Muy bien""","""Están muy bien conservadas las momias, la visita a este museo es parte de los atractivos de Guanajuato.""",México,Español,PC,2016-12-05,positivo
Masculino,46.0,Internacional,Muy bueno,4,198,"""Historia de la momificación""","""Museo que muestra algunos personajes de la historia de la ciudad que fueron momificados, y tiene todas las comprobaciones que la momificación había sido hecha y resguardada la estructura ósea y más algunas cosas.""",Portugal,Portugués,Móvil,2016-11-30,positivo
Femenino,50.0,Internacional,Muy bueno,4,37,"""Museo-Exposición""","""El museo más famoso y más publicitado en Guanajuato, aunque en esta hermosa ciudad hay muchos lugares mucho más interesantes. Yo llamaría a este museo una sala de exposiciones, donde las exhibiciones son momias desafortunadas desprovistas de descanso eterno. Sin embargo, vale la pena una visita, especialmente en compañía de una guía interesante. En este caso, 15-20 minutos pasados ​​aquí te darán nuevas emociones e impresiones.""",Rusia,Ruso,PC,2016-11-29,positivo
Masculino,64.0,Internacional,Muy bueno,4,137,"""Momias""","""Macabro museo donde se exponen 108 cuerpos desenterrados del cementerio contiguo, donde se habían momificado de manera natural.""",Venezuela,Español,PC,2016-11-29,positivo
Masculino,24.0,Nacional,Excelente,5,104,"""Escalofríante""","""No hay muchas palabras para describir este lugar, simplemente son recintos llenos de cadáveres que lucen escalofríantemente conservados. Lo interesante es la historia detrás de muchos de estos personajes y como fueron localizados.""",México,Español,PC,2016-11-29,positivo
Masculino,46.0,Internacional,Regular,3,18,"""Visita obligada""","""Creo que es uno de los atractivos de la ciudad y se tiene que visitar al menos alguna vez. Sin embargo es bastante extraño estar pagando por cadáveres se siente un ambiente pesado. El recorrido es muy corto en menos de 15 minutos ya habíamos terminado. Al salir hay muchos vendedores acosándote queriendo que compres sus productos. No creo que sea recomendable para personas impresionables o incluso niños pequeños.""",Estados Unidos,Español,Móvil,2016-11-28,neutral
Femenino,38.0,Internacional,Excelente,5,5,"""Take a selfie with Death""","""Personalmente, odiaba este museo y lo encontraba aterrador, sin embargo, parecía solo en este horror mientras un montón de escolares y turistas paseaban entre los cuerpos momificados frescos como pepinos.

Le he dado cinco estrellas porque aprecié lo modesto y auténtico que es el museo, lo innegablemente original y si quieres llegar al corazón palpitante de la relación apasionada de México con la muerte/vida, este lugar es importante.

Me apresuré en 3 minutos y (extrañamente, lo sé) caminé hasta el cementerio amurallado (ver foto) a 5 minutos. Me encanta pasear por cementerios extranjeros, leer los epitafios e imaginar las historias de los lugareños. Entonces, Death-Lite salvó el día"".",Estados Unidos,Inglés,Móvil,2016-11-26,positivo
Femenino,25.0,Nacional,Excelente,5,100,"""Excelente museo""","""Excelente museo, el personal muy amable, el guía nos explico todo muy bien desde el inicio, las momias impresionantes y el museo muy cuidado. a pesar de que fuimos en día festivo y había demasiada gente, la fila avanzo muy rápido y pudimos entrar al museo sin ningún problema.""",México,Español,PC,2016-11-25,positivo
Masculino,32.0,Nacional,Regular,3,118,"""Nada del otro mundo…""","""Este lugar por lo general está catalogado como un Increíble Museo. En mi opinión personal considero que es una visita que debes hacer 1 vez en tu vida, solo como cultura, o como conocer algo nuevo, pero nada más. Es interesante ver y saber cual fue el motivo por el cual estos cuerpos se han conservado durante tanto tiempo. Por lo regular la fila para las taquillas es bastante larga, sin embargo el tiempo de espera es aprox de 40-45 min. El costo del boleto por persona es de 60 pesos aprox, lo cual considero algo elevado debido a que el recorrido es corto y no hay tanto que ver como esperarías. A pesar de todo creo que es una experiencia más y una visita obligada.""",México,Español,PC,2016-11-24,neutral
Femenino,,Internacional,Muy bueno,4,25,"""Interesting""","""Consejo profesional: tome un taxi. Se trata de una caminata de 2 millas desde el centro histórico y algunos de los vecindarios están un poco aislados. El concepto en sí es interesante. Estos son cuerpos momificados naturalmente que fueron exhumados del cementerio local para dejar espacio para más entierros Muchos van desde finales del siglo XIX hasta principios del XX.

El recorrido en sí es bastante corto, unos 20-30 minutos. Hay una persona designada como su guía turístico que no está en la nómina del museo, por lo que debe darle una propina al final. Sin embargo, vale la pena porque el museo realmente no tiene muchas placas informativas sobre los cuerpos que se muestran allí.

Les di un 4 en lugar de un 5 debido a algunas cosas que le restaron valor a la experiencia. Es decir, desearía que el propio museo hiciera un mejor trabajo organizando las visitas. Estaría dispuesto a pagar un poco más para que un guía turístico en su nómina nos muestre los alrededores. Lo que inicialmente fue frustrante es que llegamos allí y había un grupo de personas esperando. Si se hubiera comunicado mejor el hecho de que estaban esperando a un guía, me habría sentido menos frustrado por esperar. Las momias también deberían tener placas informativas, creo, en caso de que alguien en su grupo sea ruidoso y no pueda escuchar lo que dijo la guía sobre una exhibición en particular.

Aun así, vale la pena la caminata"".",Estados Unidos,Inglés,Móvil,2016-11-24,positivo
Masculino,40.0,Nacional,Pésimo,1,7,"""Disappointed""","""No disfruté del museo... Todo estaba tan desorganizado, ruidoso y lleno de gente... No puedes tomarte el tiempo de mirar y admirar"".",México,Inglés,Móvil,2016-11-22,negativo
Masculino,41.0,Internacional,Regular,3,30,"""Creepy but part of local history and those are not actual mummies""","""Sí, esos no son cuerpos momificados, sino simplemente personas muertas que se conservaron de esa manera a través del proceso de deshidratación.

El contexto de cómo sucedió esto es parte de la historia de Guanajuato y de México.

No para las personas que se impresionan fácilmente, las momias bebés e incluso un feto son bastante espeluznantes"".",Argentina,Inglés,Móvil,2016-11-22,neutral
Femenino,31.0,Nacional,Excelente,5,13,"""Excelentes condiciones""","""Las momias estan perfectamente cuidadas, la explicación al principio es excelente y es algo del otro mundo. No visitar con pequeños que se sorprenden fácilmente ya que algunas tienen unas caras perturbadoras.""",México,Español,PC,2016-11-21,positivo
Masculino,57.0,Nacional,Excelente,5,31,"""Great museography""","""El museo tiene una gran museografía, te llevan desde la entrada en un grupo de 30 personas acompañados de un guía actor, que te explica datos interesantes de las momias. Es un lugar que no te puedes perder.""",México,Inglés,Móvil,2016-11-21,positivo
Masculino,45.0,Internacional,Excelente,5,91,"""Worth a visit and stop by the attached cemetery too!""","""Vale la pena la visita y subir la colina. Asegúrate de visitar el cementerio adjunto. Fuimos en el Día de los Muertos, muy especial"".",Canadá,Inglés,Móvil,2016-11-20,positivo
Femenino,41.0,Nacional,Malo,2,26,"""Con cautela""","""A mí en lo personal no me gustan las momias pero a mi hijo le encantan, yo creo que es un poco caro pero están en buen estado y esta bonito. Cuidado porque ofrecen estacionamiento antes de llegar al museo siendo que en el museo hay lugar para estacionarse y también cobran. También tienes que pagar una cuota por sacar fotos.""",México,Español,Móvil,2016-11-15,negativo
Masculino,27.0,Nacional,Regular,3,22,"""Fila interminable""","""Es muy lejos, llegar a pie desde el centro es muy complicado todo en ascenso y muy pesado. Una fila interminable, cobran 1,600.00 por meter cámaras réflex lo cual me parece una exageración. Una hora y media de fila y no quedamos cerca de entrar.""",México,Español,PC,2016-11-15,neutral
Masculino,38.0,Internacional,Excelente,5,17,"""Impresionante""","""Impresionante. Un lugar de vista obligada. Puedes llegar caminando desde el centro. Te recomiendo no hacerlo en feriado. Me cuentan que podría ser insoportable. En mi caso fue un fin de semana cualquiera y pudimos disfrutar del lugar muy bien. Debes pagar poco más de un dólar para que te permitan hacer fotos.""",Estados Unidos,Español,Móvil,2016-11-15,positivo
Femenino,32.0,Nacional,Excelente,5,56,"""Impresionante""","""Pensé que no me sorprendería ir de nuevo al museo, la última vez que fui fue hace más de 18 años. ¡Pero, oh sorpresa! ¡Me encantó! Esta súper bien iluminado, bien señalizado, limpio, conservado, las momias están resguardadas bajo luz y temperatura especial, cada momia tiene su historia bien redactada... una excelente oportunidad parte de nuestra cultura mexicana. ¡Vale la pena ir! Ideal para ir con la familia.""",México,Español,Móvil,2016-11-15,positivo
Masculino,36.0,Internacional,Regular,3,33,"""Looking at mummified bodies""","""La experiencia inicial fue que realmente no deberíamos estar haciendo esto. Se sintió un poco extraño y un poco mal. Las mamás están en vitrinas y están tan cerca que puedes ver cada expresión y cabello en su rostro. La gente está en voz alta para tomar imágenes que nuevamente parecían incorrectas. Sin embargo, después de pasar 5 semanas aquí y presenciar las celebraciones que se llevan a cabo, se ha hecho evidente que la muerte es algo que los mexicanos celebran, y parece que no hay nada que temer o algo por lo que estar triste"".",Costa Rica,Inglés,PC,2016-11-15,neutral
Masculino,36.0,Internacional,Regular,3,30,"""De paseo""","""Tiene aproximadamente 80 cuerpos en exhibición, las tienen bien conservadas y el recorrido es muy rápido. El recorrido dura alrededor de 20 minutos Lo malo es que para tomar fotos tienes que pagar algo extra.""",Ecuador,Español,Móvil,2016-11-13,neutral
Femenino,44.0,Nacional,Excelente,5,4,"""Para conocer""","""Me gustaba más antes, ahora lo veo ya muy modernizado y eso no se me hace tan realista ni tan tradicional.""",México,Español,Móvil,2016-11-13,positivo
Masculino,,Nacional,Excelente,5,11,"""Excelente""","""Muy bueno para ir con los niños. Un poco descuidado pero vale el boleto. Lo malo son los vendedores de dulces que están afuera, no hagas mucho caso de ellos. Los tours en las vagonetas no lo recomendaría mucho, escoje con calma quien te dará el tour por la ciudad. En todos lados te piden propinas, eso es un poco extraño. No le creas mucho a las personas que te quieren vender tours guiados.""",México,Español,Móvil,2016-11-12,positivo
Masculino,26.0,Internacional,Muy bueno,4,421,"""Hermosa exposición""","""Hermosa exposición de momias, tienen todos los tamaños y edades, no es realmente bastante espeluznante, diría, pero para ver si estás en Guanajuato.""",Francia,Francés,Móvil,2016-11-11,positivo
Femenino,35.0,Nacional,Muy bueno,4,12,"""Visita obligada""","""Es una visita obligada, ir y no ver las Momias por lo menos 1 vez en tu vida es como no haber ido a Guanajuato. A los niños se les hace muy interesante, aún que no hay mucho que hacer, más que ver las momias, es interesante para todo tipo de edades. Las instalaciones han mejorado, no son excelentes y lo malo también es el estacionamiento y la calle por la que llegas al sitio ya que es una distancia muy corta y el tiempo en recorrerlo es muy largo ya que vas a vuelta de rueda en temporada de vacaciones y fines de semana.""",México,Español,Móvil,2016-11-10,positivo
Femenino,57.0,Nacional,Muy bueno,4,15,"""Bueno""","""El museo es bueno, algo caro pero bueno. Sus pasillos con las momias son tétricos y eso lo hace genial. Sólo que si quieres ir disfrutando sólo el lugar deja pasar los escandalosos grupos. Muy recomendable. Si vas a Guanajuato no puedes dejar de visitarlo.""",México,Español,Móvil,2016-11-08,positivo
Femenino,28.0,Internacional,Regular,3,14,"""Very much what it says, a museum of mummies""","""El museo tiene una amplia exhibición de momias, pero no mucho más. Hay información impresa y la oportunidad de ver la momia más pequeña del mundo y la momia mejor conservada. Sin embargo, después de 4 o 5 salas de exhibiciones de momias, obtiene una un poco 'lo mismo de siempre'. Vale la pena para una visita rápida si puede encajar (no tomará más de 30 minutos, pero está un poco caminando desde el centro de la ciudad), pero no es una visita obligada"".",Inglaterra,Inglés,Móvil,2016-11-06,neutral
Masculino,47.0,Nacional,Excelente,5,464,"""Uno de los museos de momias de Guanajuato""","""Ubicado a un costado del panteón, se ubica este edificio transformado en museo que expone las primeras momias encontradas en la ciudad, además de niños angelitos momificados.""",México,Español,PC,2016-11-04,positivo
Masculino,33.0,Nacional,Muy bueno,4,30,"""Visita momias""","""Es un museo remodelado con gran variedad de momias, los guías son muy profesionales, el lugar no es caro, se visita en 30 minutos.""",México,Español,PC,2016-11-03,positivo
