Masculino,48.0,Nacional,Muy bueno,4,17,"""Visita obligada en Guanajuato""","""Lo mejoraron muchísimo, la espera es larga, pero vale la pena, guías atentos, lo tienen en buen estado.""",México,Español,PC,2014-07-01,positivo
Femenino,23.0,Internacional,Excelente,5,84,"""Excelente""","""El museo es impresionante, si vas a Guanajuato no podés dejar de ir, es fácil llegar, te explican con un video, el por qué del estado de los cuerpos que quedan momificados,la verdad es que vale la pena.""",Uruguay,Español,PC,2014-07-01,positivo
Femenino,45.0,Internacional,Excelente,5,142,"""Museo de Momias Naturales de Guanajuato""","""Los primeros cuerpos momificados fueron extraídos en un cementerio local en 1865. Desde entonces, se extraen regularmente, están en excelentes condiciones, otros son peores. Y se convirtieron en una parte integral de la vida y la cultura locales. Los mexicanos tienen una actitud especial hacia la muerte y su manifestación. Y este museo en su (si divagas desde la visión europea de la vida futura) es un lugar muy espiritual. A la entrada de los visitantes se encuentra la momia de un médico francés que vivió en Guanajuato en el siglo XIX. En el plato está su historia en primera persona. Para nosotros, esto es extraño, pero para los habitantes de este museo, los mexicanos son tratados con respeto, honor y gratitud. Por lo tanto, las historias en primera persona en tiempo presente parecen bastante apropiadas. El fenómeno de la momificación natural es algo sorprendente. Algunos cuerpos se conservaron perfectamente, algunos peor, algunos se dañaron durante la extracción. Las momias constantemente ""de gira"" y ya han ganado gran popularidad. El museo solo almacena los cuerpos de aquellos que no tienen descendientes directos, y para quienes no hay nadie que pague por el lugar en el cementerio. Tales entierros después de 50 (?) Años se vuelven a enterrar en fosas comunes, y los cuerpos momificados entran en la exposición del museo. En 2007, el museo se reorganizó sustancialmente, hubo salas temáticas. En la entrada los servicios son ofrecidos por guías, excursiones muy informativas e interesantes, pero al final las guías suelen recibir consejos. Estuvimos en este museo en 2012 y en 2014. Durante este tiempo, el museo se hizo aún más interesante. El sitio web del museo: http://www.momiasdeguanajuato.gob.mx/english/""",Rusia,Ruso,PC,2014-06-28,positivo
Femenino,,Nacional,Excelente,5,85,"""Tradición""","""Este museo es una tradición de Guanajuto, el museo es pequeño, si quieres tomar fotos debes pagar una cuota extra, es muy impresionante ver las momias, y la historia que algunas tiene.""",México,Español,PC,2014-06-23,positivo
Masculino,35.0,Internacional,Excelente,5,119,"""Visita espeluznante que vale la pena""","""Uno de los lugares más interesantes para conocer en Guanajuato, el famoso Museo de las Momias reúne cadáveres que no se descomponen de unos 100 años. Aunque es asustadizo, es uno de los atractivos que no se puede dejar de conocer al pasar por la ciudad.""",Brasil,Portugués,PC,2014-06-21,positivo
Femenino,57.0,Internacional,Muy bueno,4,142,"""Para quien disfrute arqueología e historia""","""Es muy interesante para quien disfrute de aprender en los viajes. Las momias son viajeras (es un acervo fijo, pero ya estuvieronen exposiciones). Se conservan, pero es algo que impresiona pues son de las excavaciones de la propia ciudad y la conservación impresiona bastante. Me gustaría tener acceso a mayor información. Pero por el insólito de la exposición, fue un paseo que dejó recuerdos. México valoriza mucho todo de su tierra y eso es literal en ese caso. Recomiendo. (que los niños pequeños pueden ser un poco espeluznante). Zapato cómodo y flexible y recomendado.""",Brasil,Portugués,PC,2014-06-21,positivo
Masculino,38.0,Internacional,Excelente,5,8,"""Museo de las Momias Guanajuato""","""¡Pasear por Guanajuato y no conocer ese Museo, no vale! De cierta forma la visita gira con nuestros sentimientos, pero te hace pensar en todas las historias que allí descubre. ¡Historia viva! ¡Historia muy interesante de esa ciudad!""",Portugal,Portugués,PC,2014-06-20,positivo
Masculino,25.0,Nacional,Muy bueno,4,92,"""UN CLÁSICO DE GUANAJUATO""","""A menos de 15 minutos del centro en transporte público, encontrarás esta atracción guanajuatense.

¿Por qué visitarlo? Porque es como no haber ido a Guanajuato. Porque un video introductorio te explica qué es una momia y por qué están los cuerpos en ese estado. Porque te ofrecen recorrido por una gratificación voluntaria al guía.

¿Por qué no visitarlo? Si no quieres ver cadáveres con expresiones hórridas, mejor no vayas. Lo que te puedo decir es que durante mi visita no escuché niños llorando o negarse a entrar.""",México,Español,PC,2014-06-17,positivo
Femenino,36.0,Internacional,Muy bueno,4,155,"""Impresionante""","""Todas las edades, hombres, mujeres y niños, hasta una mujer embarazada, es ver algo diferente e impresionante, no todas son momias antiguas, es por el tipo de suelo que se preservan y cambian algunas cada cierto tiempo.""",Guatemala,Español,PC,2014-06-17,positivo
Masculino,70.0,Internacional,Regular,3,38,"""Mummies""","""Historia interesante e información de fondo. Sin embargo, sentí que era más o menos. Tal vez, ¿porque se agregaron algunas momias para que parecieran vampiros? No es necesario"".",Estados Unidos,Inglés,PC,2014-06-17,neutral
Femenino,33.0,Internacional,Muy bueno,4,41,"""Spooky, but a Neat Experience""","""Este museo es, como uno puede imaginar, un poco espeluznante al principio. Algunos de los cuerpos que fueron enterrados vivos tienen un aspecto horrible en sus rostros. Pero realmente es fascinante lo bien conservados que están los cuerpos (especialmente porque fueron momificados de forma natural. ) Hay un video informativo en español, pero la mayoría de las placas de identificación tienen descripciones en español e inglés. Tómese el tiempo para leer las historias de cómo algunas de estas momias llegaron a ser o cómo murieron, es realmente increíble.

Al final hay una habitación separada que en realidad es petrificante. Básicamente se trata de personas que sufrieron una muerte desafortunada o fueron torturadas. Esta fue la única vez que estuve realmente asustada.

En general, muy bueno para ver. Había niños pequeños aquí cuando los visité, pero personalmente creo que solo estás pidiendo que la ciudad de las pesadillas traiga niños aquí.

Ven un día de semana para evitar filas. La entrada cuesta $55 pesos por persona (alrededor de $5 USD). Técnicamente, se supone que debes pagar $20 pesos para tomar fotografías, pero nadie lo sabría si no lo hicieras"".",Canadá,Inglés,PC,2014-06-17,positivo
Masculino,52.0,Internacional,Muy bueno,4,35,"""Day trip to Guanajuato""","""Esto es imprescindible si estás en Guanajuato. Las momias están en buenas condiciones y puedes ver muchos 'detalles' en ellas. El museo se encuentra debajo del cementerio donde se encontraron las momias"".",Estados Unidos,Inglés,PC,2014-06-15,positivo
Femenino,55.0,Internacional,Regular,3,60,"""Interesante, pero…""","""Mal organizado, cobran por tomar unas fotos de algo que se encuentra poco explicado y mal organizado. Nos interesó por lo diferente pero sentimos decepción a la salida.""",Colombia,Español,PC,2014-06-08,neutral
Femenino,48.0,Internacional,Regular,3,50,"""Strange""","""No estoy seguro de qué fue todo el alboroto sobre este museo. Fue un poco espeluznante. No había mucha información aparte del video introductorio que estaba en español"".",Estados Unidos,Inglés,PC,2014-06-03,neutral
Masculino,45.0,Internacional,Muy bueno,4,186,"""AN EXPERIENCE!!!""","""¡Mamá extraña! ¡Dios mío! para los niños pequeños, puede ser aterrador, pero cuando veas lo bien que se conservan NATURALMENTE, ¡te impresionará!
¡algunos detractores no pueden apreciar cuál es el verdadero significado de este tipo de museo!""",Estados Unidos,Inglés,PC,2014-05-26,positivo
Masculino,46.0,Internacional,Excelente,5,47,"""Guanajuato, Guanajuato, Mexico""","""Increíble museo, tienes que ser una persona fuerte para no quedar realmente impresionado o (deprimido) por lo que vas a ver. Momias reales en las posiciones más inusuales... incluida una momia infantil... ¡¡¡interesante, no te lo pierdas!!!""",Estados Unidos,Inglés,PC,2014-05-15,positivo
Masculino,59.0,Internacional,Malo,2,15,"""Mummies""","""Debes saber con anticipación, estas son momias reales, si no quieres ver cadáveres preservados, ¡no vayas! Dudaba, pero me gustaron las historias que se publicaron junto a algunos de los cuerpos: quiénes eran cómo murieron... ¡Pensé que esta era una gran manera de honrar a los difuntos! Luego, el último pasillo se convierte en una casa de fantasmas, usan cadáveres para tratar de asustarte. Pensé que esto solo era una injusticia para ti. ¡Todo el recorrido, la gente y las familias de los difuntos! Nunca se lo recomendaría a nadie. Triste"".",Estados Unidos,Inglés,PC,2014-05-14,negativo
Masculino,42.0,Internacional,Muy bueno,4,195,"""These types of places are amazing!""","""¿Qué más puedo decir? Este lugar fue una de nuestras únicas razones para visitar Guanajuato. Es un espléndido casco antiguo con mucho más que piel vieja y seca para encantarte, pero esto es sobre lo que estoy escribiendo. Uno puede visitar el espeluznante Los confines del centro comercial principal de momias del hemisferio norte simplemente caminando desde la ciudad. Los letreros están en inglés y en español. La historia de los museos, los temas disecados son individuales. Ninguno es demasiado antiguo y uno es relativamente moderno. Este es un lugar fascinante. para vagar durante una hora. Simplemente disfrute de las vistas únicas que tiene ante usted y sienta el significado. Un lugar increíble, sin duda"".",Estados Unidos,Inglés,Móvil,2014-05-13,positivo
Masculino,22.0,Nacional,Muy bueno,4,26,"""Momias""","""Muy bueno el museo, lo malo es que cuando fui había mucha gente y por lo mismo no pude apreciar con detalle.""",México,Español,PC,2014-05-09,positivo
Masculino,30.0,Nacional,Muy bueno,4,24,"""Visita obligada""","""Si vas a Guanajuato, tienes que vistar la momias, el museo es pequeño y el recorrido no dura más de 3 minutos. En lo personal no me gustó la explicación del guía porque le falta un poco de documentación.""",México,Español,PC,2014-05-08,positivo
Femenino,56.0,Internacional,Muy bueno,4,24,"""Fascinating stuff""","""Interesante e inquietante, el Museo de las Momias de Guanajuato vale la pena el viaje. Una colección de reliquias espeluznantes, alineadas en vitrinas en la penumbra. No hay mucha información a la mano, pero suficiente para entender la esencia y estás cerca lo suficiente como para estudiar minuciosamente cada detalle físico, aunque estas pobres almas nunca habrían imaginado estar en exhibición pública siglos después y, de esa manera, la exhibición tiene cualidades tanto voyeristas como conmovedoras.

Un grupo de escolares allí al mismo tiempo se divertían, aunque uno o dos parecían aterrorizados. Me imagino que hubo algunas pesadillas esa noche, por lo que podría valer la pena considerar si es adecuado para los niños que puedan tener.

El costo fue de 45 pesos para una entrada de adulto más otros 20 para usar mi cámara"".",Emiratos Árabes,Inglés,PC,2014-05-06,positivo
Femenino,44.0,Nacional,Muy bueno,4,14,"""Interesante lugar""","""Me pareció muy interesante como los cuerpos se han conservado a lo largo de los años, me hubiera gustado contar con algun tipo de explicación más amplia acerca de los mismos, como el por qué fueron exhumados los cuerpos.""",México,Español,PC,2014-05-05,positivo
Femenino,33.0,Nacional,Muy bueno,4,20,"""Impresionante""","""La verdad no soy partidiaria de estas visitas (me dan algo de miedo), sin embargo a mi esposo le encantó, es una experiencia única, pensar que esos cuerpos alguna vez tuvieron vida.""",México,Español,PC,2014-05-05,positivo
Femenino,27.0,Nacional,Muy bueno,4,12,"""¡Uy! ¿tienes miedo?""","""Atrévete a conocer uno de los museos mas escalofríantes de México, principalmente por su macabra colección de antiguos cadáveres momificados. Algunos te llenaran de terror, otros asco y unos tristeza. Definitivo visita obligada y con costos accesibles.""",México,Español,PC,2014-04-28,positivo
Femenino,51.0,Nacional,Muy bueno,4,104,"""Momias que no asustan""","""En este lugar se puede ver los cuerpos de las momias que han estado allí por muchísimos años algunos tienen caras de horror, hay uno que era muy alto y también hay fetos momia, interesante lugar, también se pueden adquirir toda clase de souvenirs.""",México,Español,PC,2014-04-25,positivo
Femenino,29.0,Nacional,Malo,2,8,"""Mal organizado""","""Visitamos el museo en semana santa y fue un caos total, muchísima gente, hicimos 1 hra. de fila y entramos casi en bola, no había ni una persona del museo que diera una instrucción o explicaciones, de hecho sabemos que en cualquier museo no se puede usar el flash para las fotos y hubo muchas personas que lo usaban y nadie les llamo la atencion. No hay A/C y sinceramente esta muy chafa. En general, estaba sucio, muchísima gente y no vimos vigilancia en ningun momento.""",México,Español,Móvil,2014-04-23,negativo
Masculino,34.0,Nacional,Pésimo,1,22,"""Debería estar en el último lugar de cosas por hacer en Guanajuato""","""¡Se encuentra a 10 min de centro caminando pero de subida! Después de la cansada caminata hicimos fila para entrar de aproximadamente 1 hora. Pagamos 55 pesos por persona por la entrada, ¿y que encontramos? 3 o 4 salones con momias un amontonamiento de gente y un calor sofocante, porque no tienen aire acondicionado ¿ok?, tienen algunos abanicos para ventilar el lugar. Aparte si quieres tomar fotos por derecho de cámara te cobran 20 pesos aparte de tu entrada. En resumidas me arrepiento de haber perdido mi tiempo y dinero en esta atracción.""",México,Español,PC,2014-04-23,negativo
Femenino,42.0,Internacional,Regular,3,3,"""Raro""","""A mí en lo personal eso de ver gente muerta, no me hizo mucha ilusión pero reconozco que la historia sobre las momificaciones naturales me llamó la atención.""",Venezuela,Español,PC,2014-04-23,neutral
Masculino,34.0,Nacional,Excelente,5,21,"""Lleguen temprano en temporada alta""","""El museo es bueno, sin embargo si van en temporada alta procuren estar a las 9:00 am. que es la hora en que abre sus puertas, yo acudí un día antes después del mediodía, primero para llegar horas por el tráfico para subir al museo y segundo colas de hora y media a dos horas para entrar, regrese al día siguiente a las 9 y entre sin problemas.""",México,Español,PC,2014-04-21,positivo
Femenino,25.0,Nacional,Excelente,5,37,"""Guanajuato´s benchmark""","“Guanajuato es famoso por sus momias, así que no te puedes ir sin visitar este museo. Tiene descuentos para estudiantes, profesores y adultos mayores. La visita guiada dura menos de 30 minutos y puedes ver estas momias únicas y conocer su historia. Estas momias son especiales porque son las únicas que no fueron embalsamadas para su conservación, lo hicieron de forma natural”.",México,Inglés,PC,2014-04-21,positivo
Femenino,32.0,Internacional,Muy bueno,4,70,"""¡Sorprendente!""","""Antes de ir a este museo estábamos llenos de a priori como: ""Mira QUE momias ... genial ..."". Pero, no son solo momias. La escalada puede parecer larga, pero descubrir la ciudad a medida que se toma la altitud es una delicia. La larga cola puede desanimarlo, pero la visita se realiza en grupos de 30 personas cada 5/10 minutos, la espera es menor. Una vez dentro, un guía explica todo lo que necesita saber sobre este lugar y las momias al referirse a estudios científicos. Todo es muy interesante, ni demasiado largo, ni demasiado corto, ni demasiado pomposo. Plano, el lugar no es adecuado para recibir a tantas personas a la vez y en algunas habitaciones es imposible que todo el grupo entre y parte de él no escuche las explicaciones.""",Canadá,Francés,PC,2014-04-19,positivo
Femenino,19.0,Nacional,Excelente,5,12,"""Interesante""","""El personal es muy amable, tienen descuentos para estudiantes y docentes, las instalaciones tienen mucha relación con la información que brinda.""",México,Español,PC,2014-04-19,positivo
Masculino,36.0,Nacional,Muy bueno,4,144,"""Es una experiencia diferente""","""Visite el museo de las momias con mi esposa y mi hijo, es una experiencia diferente ya que ver a las momias es ver muertos secos, literal, lo importante es entender el por qué están así. Te dan una explicación, pero si quieres saber más hay guía, la visita dura 45 minutos.""",México,Español,Móvil,2014-04-16,positivo
Femenino,28.0,Nacional,Muy bueno,4,20,"""Punto obligado en Guanajuato""","""Lugar para visitar y asombrarse con la momias que están vestidas con ropa de la época, enfrentar esa tradición que tiene el mexicano con la muerte, para pequeños no es muy apta ya más bien de adolescentes en adelante.""",México,Español,PC,2014-04-16,positivo
Masculino,64.0,Nacional,Pésimo,1,8,"""No es de mi gusto""","""No es un museo histórico, los cuerpos que se exhiben no están contextualizados en su época o en su relevancia social. Su única cualidad es que se momificaron por las condiciones propias del terreno donde fueron sepultados. Para quien le guste el morbo. (lo visité en mi infancia, hace más de 40 años, la aclaración por la fecha de abajo)""",México,Español,PC,2014-04-15,negativo
Femenino,40.0,Nacional,Muy bueno,4,33,"""Visita obligada""","""Este museo es famoso en todo el mundo es prácticamente forma la identidad del Estado de Guanajuato, es impresionante ver de cerca los cuerpos de las personas momificadas, el acceso se me hizo algo elevado, afuera venden muchas 'charamuscas' que son dulces de figuras de azúcar si regateas y te llevas varias seguro consigues un muy buen precio.""",México,Español,PC,2014-04-15,positivo
Masculino,48.0,Internacional,Excelente,5,48,"""No apto para todos""","""Interesante exposición de Momias de todo tipo, algunas muy raras, pero valió la pena el largo recorrido para llegar a ellas y pasas el calor que pasamos.""",España,Español,PC,2014-04-02,positivo
Femenino,,Internacional,Muy bueno,4,30,"""Interesante""","""Museo muy interesante, pero un poco ""pesado"" para quien no esté preparado psicológicamente. Hay historias tristes, y para las embarazadas y los niños no es aconsejable, ya que hay momias de bebés y de niños.""",Portugal,Portugués,PC,2014-03-31,positivo
Femenino,29.0,Internacional,Excelente,5,9,"""Biggest Mummy Collection in the World!!""","""¡Este lugar fue increíble! ¡No lleves a niños pequeños porque da miedo! ¡Hay una gran cantidad de momias allí, cada una con una historia única! Paga más para traer tu cámara para tomar fotografías. Tienen la momia más pequeña del mundo ( fetus). ¡¡No puedo perderme este lugar!!""",Estados Unidos,Inglés,PC,2014-03-25,positivo
Masculino,26.0,Nacional,Muy bueno,4,126,"""One of your oddest museums you will ever go to""","""Es un lugar un poco espeluznante. Todo, desde bebés momificados hasta adultos. No es un lugar al que llevaría a mis hijos, pero los visitantes mexicanos lo hicieron e incluso hicieron que sus hijos posaran con las momias. Mamá y mamá. Vale la pena tomar Un taxi o el autobús hasta el centro, ya que está bastante alto. Puedes caminar de regreso al centro fácilmente"".",México,Inglés,PC,2014-03-23,positivo
Femenino,51.0,Nacional,Excelente,5,2,"""Visita en Guanajuato""","""Fue un viaje maravilloso, una de las ciudades más fabulosas del país. Tuvimos una vista maravillosa con terraza, muy tranquilos y nos llenamos de historia.""",México,Español,PC,2014-03-19,positivo
Masculino,55.0,Internacional,Excelente,5,28,"""Fascinating Place for people suited to it""","""El museo de las momias fue fascinante para nuestra pandilla, ya que teníamos varios científicos, ingenieros y médicos entre la multitud... así que las momias son más una exhibición de ciencia/historia natural que una exhibición espeluznante de los muertos. Decide cuál sería sea ​​para usted y sabrá si debe ir. Las exhibiciones fueron excelentes, de buen gusto y bien documentadas. Verdaderamente fascinante y sorprendente de ver. Planee suficiente tiempo para leer todo y examinar las radiografías y las exhibiciones de apoyo. Volveremos la próxima vez estamos en la ciudad"".",Estados Unidos,Inglés,PC,2014-03-19,positivo
Femenino,61.0,Internacional,Muy bueno,4,151,"""¡Impresionante!""","""Este museo es muy peculiar, pues podemos ver cuerpos que fueron momificados por la acción del propio suelo del local. En la entrada asistimos a una breve explicación sobre cómo ocurrió la momificación, y luego podemos pasear y admirar la exposición. En particular no me gustan los museos, pero eso ciertamente vale la pena una visita.""",Brasil,Portugués,PC,2014-03-18,positivo
Femenino,48.0,Nacional,Muy bueno,4,68,"""Momias de Guanajuato""","""Lo más interesante fue la explicacion de porque están en ese estado (la forma en que son sepultados) y el hecho de que las investigaciones recientes desmientan muchas de las cosas que anteriormente se decían al respecto. Si son impresionantes.""",México,Español,PC,2014-03-10,positivo
Masculino,68.0,Internacional,Excelente,5,220,"""Well laid out and interesting""","""Si bien no es del gusto de todos, este es un museo muy interesante y bastante inusual. La historia de su fundación también es bastante interesante. Hay traducciones al inglés para cada una de las exhibiciones"".",Estados Unidos,Inglés,PC,2014-03-08,positivo
Femenino,66.0,Nacional,Excelente,5,22,"""A Must-See when visiting Guanajuato""","""Aunque no es para los aprensivos, el Museo de las Momias es definitivamente exclusivo de Guanajuato. La tarifa de entrada es razonable (pregunte por el descuento de Old Folk's; no recuerdo la edad). Un enfoque fascinante de la vida y la muerte. Yo sí No creo, sin embargo, que sea apropiado para niños pequeños.

Es una caminata larga desde El Centro, pero interesante: asegúrese de visitar el cementerio y el mausoleo cercanos"".",México,Inglés,PC,2014-03-03,positivo
Masculino,60.0,Internacional,Muy bueno,4,48,"""Interesting""","""Me alegro de haber ido, interesante desde el punto de vista científico. No recomendado para niños. Agradecemos los comentarios en inglés para que podamos entender ya que no había guías"".",Estados Unidos,Inglés,PC,2014-03-01,positivo
Masculino,28.0,Internacional,Muy bueno,4,17,"""Creepy but fun""","""Esta es una parada obligada si visitas Guanajuato. Es un museo único porque todo lo que verás son cuerpos momificados. La diferencia es que todos los restos fueron deshidratados de forma natural en lugar de ser hechos por humanos para preservarlos. Bastante interesante"".",Estados Unidos,Inglés,PC,2014-02-26,positivo
Femenino,25.0,Nacional,Excelente,5,19,"""Not to be forgotten""","""En un homenaje a las almas de los cuerpos enterrados en una tumba de segundo nivel, sus cuerpos se han conservado en menos de seis años y hoy cuentan la historia de sus vidas. Este museo, aunque un poco espeluznante y triste (exhibe no solo el la momia más joven del mundo, pero las marcas de algunas personas que murieron por diferentes causas naturales y antinaturales), pero el museo es absolutamente fascinante y definitivamente un sello distintivo de nuestro tiempo en el hermoso Guanajuato. Tenga en cuenta que es un poco difícil de encontrar y mucho más de una caminata de lo esperado, pero vale la pena. Si puedes probar y ver el cementerio también, es hermosa la forma en que celebran y normalizan la muerte en México, particularmente en esta ciudad"".",México,Inglés,PC,2014-02-26,positivo
Femenino,47.0,Internacional,Muy bueno,4,47,"""Creep and strangely compelling""","""Este es un lugar realmente extraño pero muy interesante. Nunca habíamos visto algo así. No es para los débiles de corazón. Llevamos a nuestra hija de 15 años allí porque ella quería ir. La mayoría de las veces solo decía '¡ewwww! !!' pero en realidad lo pasamos muy bien, por triste que suene"".",Estados Unidos,Inglés,PC,2014-02-22,positivo
Femenino,30.0,Internacional,Muy bueno,4,107,"""Hmm…""","""Todavía no estoy seguro de qué pensar de esta colección. En su mayor parte, los cuerpos se muestran respetuosamente, pero hay una clara sensación de voyeurismo que me deja inquieta sobre mi propia elección de verla"".",Inglaterra,Inglés,PC,2014-02-20,positivo
