Femenino,54.0,Nacional,Excelente,5,14,"""Excepcional""","""No dejen de visitar, con un guía, este local fuerte, denso. No hay un rincón sin su historia. Su percibe la pasión por el arte en ese lugar.""",México,Español,Móvil,2016-08-20,positivo
Masculino,35.0,Nacional,Excelente,5,16,"""Toda una obra de arte""","""El lugar es maravilloso, podría ser muy bien la envidia de muchas ciudades europeas. Esta excelentemente conservado. Es recomendable investigar anticipadamente si hay obra de teatro en escena para planear ya sea presenciar la obra o hacer la visita guiada.""",México,Español,Móvil,2016-08-19,positivo
Femenino,61.0,Internacional,Excelente,5,57,"""La séptima musa existe""","""Una excelente arquitectura. Exquisito. Si pueden escuchen la historia de la séptima musa. Hay espectáculos gratis o muy económicos.""",Argentina,Español,PC,2016-08-19,positivo
Femenino,37.0,Internacional,Muy bueno,4,124,"""Gran explicación de la Independencia""","""Entramos al teatro para visitarlo puesto que es precioso pero lo que más me gustó fue la explicación del guía, espectacular el afán de enseñar la verdadera historia de México.""",España,Español,PC,2016-08-18,positivo
Femenino,46.0,Nacional,Excelente,5,18,"""Dos obras de teatro""","""Excelentes visitas. Acudí a dos obras de teatro excelentes y gratis y no sólo disfrute de las actuaciones sino también de la visita al espectacular teatro. ¡Precioso!""",México,Español,Móvil,2016-08-17,positivo
Masculino,43.0,Nacional,Excelente,5,95,"""Dedícale tiempo, lo vale""","""Por primera vez entramos a recorrerlo y creo que después de bellas artes es el teatro más bello del país. Visítalo y escucha DOS veces la explicación con diferentes guias, cada uno te cuenta diferentes partes de la historia y vale mucho la pena.""",México,Español,Móvil,2016-08-12,positivo
Masculino,36.0,Nacional,Muy bueno,4,108,"""Lindo, pero deberían…""","""Un lugar muy lindo, muy clásico y con una arquitectura muy especial y espectacular. No me parece correcto que te quieran cobrar por tomar fotos con tu celular. Fuera de eso vale la pena. Otro inconveniente es que ponen lonas o mamparas para anunciar eventos y hacen que el exterior del teatro sea desagradable y salga mal en las fotos.""",México,Español,Móvil,2016-08-08,positivo
Femenino,37.0,Nacional,Excelente,5,11,"""¡Increíble!""","""Excelente estado de conservación del edificio. Buen guía, con explicación muy clara y amena y el teatro bellísimo.""",México,Español,Móvil,2016-08-07,positivo
Masculino,40.0,Nacional,Excelente,5,33,"""Atractivo único en México""","""El Teatro Juárez, un capricho de un presidente dictador, un atractivo en una Ciudad Patrimonio de la Humanidad. Esta construcción es impresionante tanto su fachada como su interior. Un lujo en los años del Porfiriato, y un espacio genuino para los eventos principales de la actualidad.  No se pierdan la oportunidad de ingresar y poder observar su esplendor.""",México,Español,Móvil,2016-08-04,positivo
Masculino,51.0,Nacional,Muy bueno,4,167,"""Teatro Juárez- Visita AS Guanajuato""","""Es uno de los lugares que si se debe visitar. De verdad vale la pena. Fue inaugurado el 27 de octubre de 1903 por el presidente Porfirio Díaz con la ópera Aída. Adentro tiene la forma de herradura que le da una magnifica acústica. Hay 4 niveles de palcos. 
En la fachada tiene ocho esculturas de bronce, que representan a ocho musas de la cultura griega y representan actividades como la comedia, la danza y la música. 

En julio no nos tocaron eventos, pero es mejor que antes de viajar chequen en se cartelera si va a tener eventos. Sus precios mas caros están en 200 pesos y van hasta los 20 pesos, lo que es muy bueno. Adentro siéntense en una butaca, dense tiempo de ver todo a su alrededor e imagínense trasportados a principios del siglo XX. 

Lo único que no me gustó fue un guía tendencioso que hizo un comentario fuera de lugar de que en el porfirismo según el lugar que habían comprado las personas era la entrada que usaban, lo cual siempre ha sido igual, antes y ahora, como si hoy por hoy no siguiera eso de la misma manera en el estadio azteca (aquellos que tienen palco entran con sus coches por una rampa y uno como hijo de familia entra caminando por otras entradas, o el auditorio nacional, o inclusive el Palacio de Bellas Artes, según el asiento que uno tiene es la puerta por donde uno entra. 

En fin, vale mucho la pena pasar ahí un rato aun cuando no vaya a haber algún espectáculo. En sus escalinatas que dan a la calle se sienta la gente a ver el show de un payaso o un animador a ciertas horas.""",México,Español,PC,2016-08-03,positivo
Masculino,26.0,Internacional,Excelente,5,8,"""Impresionante""","""Un teatro de ópera antigüo. Lujosamente decorado, con hermoso salón de baile. Para los estudiantes (incluyendo extranjera) sólo 15 pesos. Fotografiar costes adicionales, pero no está controlado; vistas) en cualquier caso.""",Suiza,Alemán,Móvil,2016-08-03,positivo
Femenino,46.0,Internacional,Excelente,5,21,"""Symphony and documentary at GIFF""","""Fui a dos eventos aquí. El interior del teatro es increíble. Muchos estilos arquitectónicos diferentes. Puedes hacer recorridos si no hay eventos. Vale la pena echarle un vistazo. En los escalones del frente suele haber entretenimiento local. Muchos cafés al aire libre y comercios de la zona.""",Estados Unidos,Inglés,Móvil,2016-08-03,positivo
Masculino,49.0,Nacional,Excelente,5,64,"""Obra maestra de Guanajuato""","""Un teatro realmente hermoso y que forma parte importante del paisaje de Guanajuato. Cerca de ahí hay un parque que resulta agradable visitar.""",México,Español,Móvil,2016-08-03,positivo
Femenino,34.0,Nacional,Excelente,5,25,"""Una joya""","""El salón fumadores es magnífico. Por una módica cuota puedes entrar a visitarlo. O asistir a algún evento cultural. Vale la pena. Al exterior lo decoran 9 musas.""",México,Español,Móvil,2016-08-01,positivo
Femenino,25.0,Nacional,Excelente,5,16,"""Enamorada de Guanajuato""","""Un lugar impresionante, que te engatusa a simple vista y te invita a conocerlo a fondo, que te embriaga a cada paso que das, que te hace soñar e imaginar las mil historias que ahí pudieron pasar, una riqueza de Guanajuato, que por ningún motivo puedes dejar de verla.
Me enamore de este lugar.""",México,Español,PC,2016-07-30,positivo
Femenino,37.0,Nacional,Excelente,5,111,"""BEAUTIFUL PLACE!""","""Definitivamente necesitas venir aquí, es hermoso espero que tengas suerte de encontrar al Sr. Ascención Guerra Aguilar, un guía turístico muy apasionado, nunca en mi vida escuché a alguien hablar con tanta pasión sobre la cultura mexicana"".",México,Inglés,PC,2016-07-29,positivo
Masculino,57.0,Nacional,Excelente,5,17,"""Un lugar precioso histórico, no puedes perderte entrar a una obra""","""Aprovechamos para disfrutar de un concierto de música clásica con guitarra que costo 20 pesos, imperdible. Este teatro fue mandado a construir al mismo tiempo que bellas artes de CDMX por el presidente Porfirio diaz. Una parada obligada en Guanajuato.""",México,Español,Móvil,2016-07-29,positivo
Masculino,43.0,Nacional,Excelente,5,35,"""¡PRECIOSO! De lo más bonito de la ciudad""","""Es un lugar hermoso, hay muy buenos espectáculos, un excelente ejemplo de la arquitectura porfiriana en el estado y en el país.""",México,Español,Móvil,2016-07-29,positivo
Femenino,42.0,Nacional,Muy bueno,4,33,"""Teatro Juárez tradición y raíces de nuestra historia""","""El Teatro Juárez es un monumento que tiene todo belleza, historia, tradición y aún está en funcionamiento podríamos decir que es un clásico porque no pasa de moda hay que admirarlo pues nos pertenece y una visita guiada vale la pena.""",México,Español,Móvil,2016-07-28,positivo
Femenino,18.0,Nacional,Excelente,5,22,"""Excelente recinto""","""Lugar excelente en compañía de tu pareja, amigos, familia o tu sola para disfrutar de una obra de teatro, escuchar unas magnificas notas musicales de una orquesta o simplemente sentarse en las escalinatas y pasar el tiempo.""",México,Español,PC,2016-07-27,positivo
Masculino,52.0,Nacional,Excelente,5,31,"""Teatro más bonito de México""","""Es una joya por fuera y por dentro. Es algo que tiene una belleza única. Es un edificio que mando contruir Porfirio Díaz.""",México,Español,Móvil,2016-07-27,positivo
Masculino,30.0,Nacional,Excelente,5,3,"""NO PIERDAS LA OPORTUNIDAD DE VISITARLO""","""Hermoso Teatro, lleno de detalles e historia; muy interesante la plática recibida durante la visita domingo 17 de julio.""",México,Español,PC,2016-07-26,positivo
Masculino,71.0,Internacional,Excelente,5,465,"""This is really beautiful""","“Esta es una estructura muy impresionante y uno se sorprende de encontrar algo así como un pueblo minero. Pero entonces Guanajuato no es CUALQUIER pueblo minero. Es una ciudad de cultura, una ciudad universitaria y una ciudad muy viva. también muy agradable por dentro, sí, es elegancia antigua pero es elegancia sin embargo. Interesante encontrar un salón para fumadores de caballeros dentro y muchas otras sorpresas. Entra, no te decepcionará.",Estados Unidos,Inglés,PC,2016-07-24,positivo
Femenino,20.0,Nacional,Excelente,5,4,"""Un lugar que no puedes perderte""","""Es una maravilla estar en este lugar, tiene visitas guiadas y el costo de entrada es muy accesible. La mayor parte de su estructura es de madera en estilo Morisco, no puedes perdertelo.""",México,Español,Móvil,2016-07-23,positivo
Femenino,50.0,Internacional,Excelente,5,105,"""Bello""","""El teatro por fuera ya sea de dia o noche es imponente. Ubicado en el mismo centro de la ciudad se alza con todo su arquitectura de una manera impresionante.""",Perú,Español,Móvil,2016-07-23,positivo
Masculino,39.0,Nacional,Excelente,5,20,"""Recomendadísimo conocer""","""Un lugar hermoso de fachada impresionante, no tuve la oportunidad de entrar pero indudablemente debe ser igual de hermoso por dentro.""",México,Español,PC,2016-07-22,positivo
Femenino,56.0,Nacional,Muy bueno,4,26,"""Amazing building ""","""Es un edificio muy hermoso y la tarifa incluye un pequeño recorrido. El teatro en sí no es muy grande pero es impresionante. Está ubicado en el centro de la ciudad, por lo que todo está cerca"".",México,Inglés,Móvil,2016-07-20,positivo
Femenino,44.0,Nacional,Excelente,5,78,"""Que joya tan hermosa""","""Tal vez vine de niña. Pero no recordaba. Que lugar tan hermoso. El teatro es una visita que no se puede omitir. Está perfectamente conservado. Es un lugar que no se puede dejar de ver en Guanajuato.""",México,Español,Móvil,2016-07-19,positivo
Femenino,56.0,Nacional,Excelente,5,15,"""Imperdible""","""Es de lo más bello Arquitectónicamente en Guanajuato y vale la pena conocerlo por dentro, por fuera y que mejor que vivirlo con el arte en algún evento o presentación artística.""",México,Español,Móvil,2016-07-15,positivo
Masculino,60.0,Internacional,Excelente,5,524,"""Nice attraction""","""Definitivamente una joya en Guanajuato. Es un edificio impresionante con una gran arquitectura por dentro y por fuera. Se puede hacer con un recorrido rápido que es económico"".",Estados Unidos,Inglés,PC,2016-07-13,positivo
Femenino,25.0,Nacional,Excelente,5,10,"""Bellísimo""","""Simplemente bellísimo. Es el punto de reunión para las callejonadas también. Recomenbable. :) esta en el mero centro frente al jardín Unión.""",México,Español,Móvil,2016-07-13,positivo
Masculino,23.0,Internacional,Muy bueno,4,16,"""Amazing building of a bygone era""","""Edificio de belleza inesperada que vale la pena visitar por una tarifa modesta, incluso si no tienes la oportunidad de ver una actuación. Siéntate en el teatro mientras admiras la arquitectura y tal vez, si tienes suerte como la nuestra, escucha un ensayo de la orquesta"".",Estados Unidos,Inglés,Móvil,2016-07-12,positivo
Femenino,57.0,Internacional,Muy bueno,4,38,"""Imperdible""","""La mayor atracción de Guanajuato es este hermoso teatro. Por fuera su fachada tipo Partenón. En su interior madera tallada y pintada. Fierro forjado en diseños elegantes y bellos.  Tapices finos en los asientos. Esculturas hermosas. Escalera importante. Vitrales. Pisos bellos. Todo es hermoso.""",Perú,Español,Móvil,2016-07-10,positivo
Femenino,39.0,Nacional,Excelente,5,15,"""Visita obligada""","""Haber ido a Guanajuato y no haber visitado este recinto, no cuenta como que fuiste a Gto y es que es majestuoso verlo, más por la noche que esta alumbrado y muy a gusto para sentarse en las escaleras y ver el movimiento de la cuidad y de los estudiantes.""",México,Español,Móvil,2016-07-10,positivo
Femenino,,Internacional,Muy bueno,4,297,"""Absolutely beautiful, but much of it was off-limits to us""","""El Teatro Juárez es un edificio impresionante, tanto por dentro como por fuera, y me alegro de haber pagado la tarifa de entrada para entrar. Sin embargo, nos decepcionó ver tantos corredores y escaleras bloqueados, lo que hizo que gran parte del teatro fuera de los límites. para nosotros. Si tienes la oportunidad de ver una actuación en este teatro (que nosotros no tuvimos), ¡hazlo por todos los medios!",Estados Unidos,Inglés,PC,2016-07-06,positivo
Masculino,36.0,Internacional,Excelente,5,65,"""Deslumbrante""","""El teatro Juárez sencillamente es un lugar que te remonta a épocas de historia, la conservación del espacio te permite observar gran cantidad de detalles y texturas que evocan tiempos de majestuosidad, el acceso es económico aunque la información es muy limitada si no vas con un guía. Sólo necesitas cerca de 30 minutos para invertir allí y que sea suficiente para una visita no guiada.""",Colombia,Español,Móvil,2016-06-28,positivo
Masculino,44.0,Nacional,Excelente,5,235,"""Bello""","""Este lugar te transporta al pasado Guanajuatense... Todos trajeados, sin duda un gran protagonista en la historia de la ciudad. Es muy bonito por dentro y por fuera, el auditorio tiene mucha influencia morisca al igual que toda la ciudad que tienen un aire muy Andaluz.... De noche se pueden tomar buenas fotos tambien con el teatro iluminado...""",México,Español,Móvil,2016-06-25,positivo
Femenino,19.0,Nacional,Excelente,5,51,"""Majestuoso""","""Arquitectónicamente es una edificación hermosa, totalmente teatral, no puedes evitar quedarte maravillado admirando las esculturas, ni perderte los detalles como los letreros de ""Drama"" y ""Comedia"" a sus costados, bello de día y mágico de noche.""",México,Español,Móvil,2016-06-23,positivo
Masculino,57.0,Nacional,Excelente,5,6,"""Increíble""","""Está padrísimo, tanto el lugar como su gente, la hospitalidad, su comida, todo, la gentileza, lo recomiendo visita Guanajuato.""",México,Español,PC,2016-06-20,positivo
Masculino,60.0,Nacional,Excelente,5,10,"""Increíble""","""Hermoso teatro no falta en la visita a Guanajuato un emblema de el estado muy bien cuidado no desperdicien cualquier evento en este recinto.""",México,Español,Móvil,2016-06-18,positivo
Femenino,53.0,Internacional,Excelente,5,241,"""¡Fachada espectacular!""","""La fachada es muy bonita. ¡Aunque el interior no es tan imponente! Merece la pena visitarlo, y -si se tiene la oportunidad- acudir a una representación.""",España,Español,Móvil,2016-06-17,positivo
Femenino,29.0,Nacional,Regular,3,154,"""Bonito""","""Tenía muchas ganas de conocer el teatro. Por dentro, lamentablemente no cumplió mis expectativas. Es más bello el teatro de NY donde fuimos a ver la obra de teatro del Rey León. Pero, bueno es un teatro con historia. Y es importante conocerlo y aprender sobre la cultura de Gusnajuato. Por fuera es mega espectacular.""",México,Español,Móvil,2016-06-16,neutral
Masculino,31.0,Nacional,Excelente,5,35,"""Hermoso""","""Es un lugar espectacular tanto por el día como por la noche es increíble los callejones es una ciudad hermosas. Su arquitectura es bellísima y esta super iluminado que lo hace mas atractivo.""",México,Español,PC,2016-06-13,positivo
Masculino,34.0,Nacional,Excelente,5,118,"""Para disfrutar de las artes""","""Para empezar la construcción es hermosa, está muy bien iluminada todo el tiempo y se encuentra en el centro de la ciudad, ofrece grandes espectáculos de diferentes artes y precios que no son muy altos, en la mayoría de los casos, hay bares y restaurantes prácticamente enfrente para pasar el rato en lo que empiezan las funciones o después de ellas, así como actividades recreativas, hay hoteles muy cerca del lugar tanto el edificio como los alrededores se encuentran siempre limpios, es una muy buena opción para pasar un momento cultural e histórico.""",México,Español,PC,2016-06-10,positivo
Masculino,49.0,Internacional,Excelente,5,712,"""Stunning""","""Este es un teatro imperdible si estás en Guanajuato. Está ubicado en el centro del Jardín de La Unión. El Teatro Juárez es uno de los edificios arquitectónicos más impresionantes de Guanajuato. La entrada principal es directamente de la antigua Roma. El diseño El estilo se inspiró en historias de la antigua Roma y Grecia. Las filas de escalones que conducen a la gran entrada se asemejan mucho al Panteón de Roma. Está abierto para un recorrido por una tarifa de $ 35 pesos. El interior es simplemente art déco impresionante. El paso son un lugar popular para pasar el rato, ver las actuaciones de los estudiantes universitarios y las bandas de mariachis"".",Estados Unidos,Inglés,Móvil,2016-06-08,positivo
Masculino,38.0,Nacional,Excelente,5,14,"""¡Bellísimo!""","""No tuvimos la oportunidad de verlo por dentro pero por fuera es una excelente obra arquitectónica que no puede faltar en tu visita a esta ciudad, de día y de noche es increíble.""",México,Español,Móvil,2016-06-06,positivo
Masculino,42.0,Nacional,Excelente,5,32,"""LUGAR ESPECTACULAR""","""El lugar es de época, te transporta a lo que se vivía al finalizar el año 1800 e iniciar el 1900. Es hermoso en cuanto a arquitectura con gran trascendencia y tiene guías muy preparados. Lo único malo es que al ingresar la información del recorrido no es clara. Pero es uno de mis sitios favoritos para volver.""",México,Español,PC,2016-06-06,positivo
Femenino,36.0,Nacional,Muy bueno,4,32,"""Una joya histórica que no debes perderte""","""Es un sitio que no debes perderte por su gran historia mexicana y su belleza arquitectónica. Es un lugar que te transporta al siglo XX cuando es inagurado por el Presidente Porfirio Díaz.""",México,Español,PC,2016-06-05,positivo
Masculino,29.0,Internacional,Excelente,5,27,"""UNA OBRA MAGISTRAL""","""Una obra, fabulosa de ingeniería. Testigo del neoclásicismo, que se aplicó durante el Porfiriato. Su fachada majestuosa decora la ciudad. Y su interior es una verdadera joya.""",Argentina,Español,PC,2016-05-27,positivo
Femenino,48.0,Nacional,Excelente,5,16,"""Hermoso, visita obligada""","""Tienes que ir, no sólo por su belleza arquitectónica, si tienes oportunidad entra al teatro a ver alguna obra, te sorprenderá lo barato que es y tendrás la oportunidad no sólo de contemplarlo por fuera, sino de vivir la experiencia completa.""",México,Español,PC,2016-05-25,positivo
Masculino,50.0,Nacional,Excelente,5,8,"""Hermoso""","""Es un hermoso trozo de historia y arquitectura, su interior como su exterior se encuentran bien conservados. Estando en su interior uno se traslada a aquellas épocas de su esplendor, y se imagina lo que ahí sucedía.""",México,Español,PC,2016-05-25,positivo
Masculino,24.0,Nacional,Excelente,5,73,"""Bellísimo""","""Uno de los teatros mas hermosos que me ha tocado visitar. Por fuera majestuoso y por dentro sobrio y elegante. Perfectamente bien cuidada la estructura que ya tiene sus buenos años. En mi viaje por Real de minas me toco un concierto de jazz a un excelente precio. Si se encuentran aqui no duden en entrar vale toda la pena.""",México,Español,PC,2016-05-19,positivo
Femenino,53.0,Internacional,Excelente,5,153,"""Must see""","""Este teatro es imperdible cuando se está en Guanajuato, hay que pagar para entrar, pero vale la pena el costo, $35 pesos por adulto. El teatro está adornado con pan de oro, hermosos revestimientos de paredes y tiene una variedad de asientos. Ojalá hubiéramos podido ver el ballet o un espectáculo para tener una sensación real del edificio ""en acción"". Los escalones del teatro son un lugar de reunión durante el día y la noche. Mucha actividad e interacción en la plaza. .""",Estados Unidos,Inglés,PC,2016-05-18,positivo
Femenino,62.0,Internacional,Excelente,5,45,"""This is a not to miss tour!""","""Estuvimos en Guanajuato durante el día después de quedarnos en San Miguel y queríamos conocer los aspectos más destacados de la ciudad. No te puedes perder el teatro, ya que está en el medio del centro histórico y justo al lado de la plaza. Asegúrate de ir adentro- tuvimos una guía con nosotros que ayudó inmensamente a escuchar la historia de este fabuloso edificio. Arquitectónicamente es impresionante por dentro y por fuera: una habitación tiene un piso de vidrio y hierro que parece el techo de la planta baja. para mostrar la riqueza de Guanajuato y su influencia cultural a nivel regional, realmente vale la pena verlo"".",Estados Unidos,Inglés,PC,2016-05-14,positivo
Masculino,20.0,Nacional,Muy bueno,4,142,"""Relajante y entretenido""","""Aquí te puedes sentar y observar la gente que va pasando, de vez en cuando hay shows y es buen descanso después de caminar por las calles y callejones de Guanajuato.""",México,Español,Móvil,2016-05-11,positivo
Masculino,52.0,Internacional,Excelente,5,409,"""Beautiful city!""","""Admito mi ignorancia, ya que no había oído hablar de este lugar hasta que fui en un viaje de negocios a León. Tuve la suerte de que mis compañeros de trabajo me llevaran allí y fue increíble. La ciudad es muy interesante con túneles para automóviles. que utilizan los túneles originales utilizados para la excavación de minerales. La ciudad es amigable para los peatones y está llena de tomas hermosas, como el Teatro Juárez. La gente es amigable, la ciudad está cuidada y los precios son razonables. Debido a que es una ciudad universitaria, hay lugares económicos Asegúrate de ir a ver el mirador a poca distancia en auto y el “castillo” en el camino.Esta ciudad tuvo una importancia histórica en la independencia de México, así que investiga un poco antes de ir para que puedas beneficiarte de los vientos de libertad. """,Estados Unidos,Inglés,PC,2016-05-11,positivo
Femenino,67.0,Nacional,Excelente,5,99,"""Un hermoso recinto cultural""","""El Teatro Juárez es un edificio muy hermoso, su visita es necesaria dentro de la visita a Guanajuato, este teatro es funcional y durante el festival Cervantino es sede de los eventos culturales más selectos, tiene luneta, anfiteatro, palcos primeros, segundos y terceros; cuenta con muy buena acústica y una arquitectura muy bella.""",México,Español,PC,2016-05-11,positivo
Femenino,68.0,Internacional,Excelente,5,103,"""See It at Night""","""Ver Guanajuato de noche es una experiencia mágica. El pueblo se ilumina como un árbol de Navidad y se convierte en una tierra bonita. Familias y amigos se quedan hasta tarde recorriendo las calles y la ciudad cobra vida. Uno de los lugares más agradables (y gratuitos) !) Las experiencias que disfrutamos fue sentarnos en las gradas del magnífico Teatro Juárez por la noche y ver a los artistas callejeros. Son de primera clase y las actuaciones pueden ocurrir a cualquier hora de la noche, cualquier día de la semana. Esté preparado para agradecer a los artistas. metiendo unos pesos en el sombrero que se reparte después de cada función"".",Estados Unidos,Inglés,PC,2016-05-06,positivo
Femenino,28.0,Internacional,Excelente,5,47,"""El lugar más lindo de Guanajuato""","""Es hermoso de noche y de día. No pude entrar porque estaba cerrado justo el día en que fui a Guanajuato, pero vaya que es impotente.""",Colombia,Español,Móvil,2016-05-05,positivo
Masculino,46.0,Internacional,Muy bueno,4,231,"""Get ready to be excited""","""Solo M$35 te permitirá entrar a este glorioso teatro. La decoración es magnífica en el teatro mismo y el área para fumar (fumar) es indicativa de la época"".",Australia,Inglés,Móvil,2016-05-02,positivo
Masculino,72.0,Internacional,Regular,3,43,"""Bonito Teatro""","""Teatro único. Absolutamente vale la pena una visita. Conseguir entradas para un evento es un misterio. Evento de baile anunciado con un día y hora específicos en que las entradas saldrían a la venta. Llegó a la taquilla a la hora designada. No hay entradas. Agotadas. ¿Cómo puede un teatro agotarse cuando las entradas aún no han salido a la venta? Hermoso teatro pero fea administración"".",Estados Unidos,Inglés,PC,2016-05-01,neutral
Masculino,65.0,Nacional,Muy bueno,4,64,"""Joya arquitectónica""","""En el centro de la ciudad de Guanajuato, se encuentra este maravilloso teatro construido entre 1873 y 1903 y que te transporta a al pasado, su nombre se debe Don Benito Juárez.""",México,Español,PC,2016-04-29,positivo
Masculino,33.0,Nacional,Excelente,5,26,"""¡Máximo recinto cultural!""","""Tanto de día como de noche puedes admirar este hermoso recinto cultural. Está en la lista de los más importantes en el país. Tiene excelente acústica y su estructura es única.""",México,Español,Móvil,2016-04-27,positivo
Femenino,50.0,Nacional,Excelente,5,3,"""¡Visita el Teatro!""","""¡Increíble lugar, que logra transportarte en el Tiempo! Vale la pena visitarlo enterarte de nuestra historia.""",México,Español,Móvil,2016-04-25,positivo
