Femenino,39.0,Internacional,Excelente,5,14,"""¡Hermoso!""","""Es el segundo teatro mas hermoso que he visto... después de Bellas artes.... Es muy lindooo. La arquitectura es hermosa. Es impresionante sin duda un lugar que visitar.""",Panamá,Español,Móvil,2014-01-12,positivo
Masculino,43.0,Internacional,Excelente,5,4,"""Amazing!""","""A cualquier persona interesada en los teatros históricos y su arquitectura le encantaría este lugar. Estuvimos allí cuando se estaba haciendo una reconstrucción, por lo que había algunas áreas acordonadas, pero es un lugar hermoso. Nos sentamos en el teatro y descansamos un rato y fue agradable y tranquilo"".",Estados Unidos,Inglés,PC,2014-01-08,positivo
Femenino,27.0,Nacional,Muy bueno,4,3,"""¡Buen lugar!""","""Un lugar con una excelente arquitectura, las lámparas, el estilo, ¡todo en si esta perfecto!Un teatro impresionante.""",México,Español,PC,2014-01-03,positivo
Masculino,54.0,Internacional,Excelente,5,37,"""Por la pestaña en sí una atracción""","""Me gustó mucho la guía identifica que era masónico y sugiere una teoría que nunca se Maximiliano fue ejecutado por Benito Juárez, como el Hermano no mata hermano. Maximiliano habría muerto por causas naturales en Managua, Nicaragua, muchos años después, donde se ha establecido un comerciante de muebles.""",Portugal,Portugués,PC,2014-01-02,positivo
Masculino,,Nacional,Excelente,5,3,"""Bonito""","""Nos encantó. Se ve majestuoso, enfrente de la plaza y cerca de los mejores bares y restaurantes... muy bonito en pocas palabras.""",México,Español,PC,2014-01-02,positivo
Femenino,23.0,Nacional,Excelente,5,232,"""Hermosísimo teatro""","""Nos encantó todo, pero sobre la sala principal, con sus lámparas gigantes y hermosísimas, el estilo que tiene el Teatro es impresionante.""",México,Español,PC,2014-01-01,positivo
Masculino,,Internacional,Excelente,5,15,"""Fantastic!""","""Este es uno de los edificios más hermosos de la ciudad, ya sea que lo visites de día o de noche, la arquitectura es una delicia, junto con el ambiente alegre, la plaza y los músicos callejeros. Perfecto para pasar un rato"".",Estados Unidos,Inglés,Móvil,2013-12-31,positivo
Masculino,52.0,Nacional,Muy bueno,4,34,"""¡Buen lugar!""","""Es un teatro muy bonito, 100% recomendable, la arquitectura que tiene es muy linda y esta ubicado en el centro, muy buen lugar para visitar.""",México,Español,Móvil,2013-12-28,positivo
Femenino,,Nacional,Muy bueno,4,7,"""Muy bonito""","""Cobran 15 pesos la entrada. Te dan una explicación (al final de piden propina) de todo el teatro y la época afrancesada por parte de Porfirio Díaz. Puedes tomar muy bonitas fotos tanto al interior como al exterior del teatro.""",México,Español,PC,2013-12-27,positivo
Femenino,29.0,Nacional,Muy bueno,4,51,"""Muy lindo""","""Hermosa fachada, lindo lugar. excelente arquitectura. foto obligatoria. etcetera etcetera etcetera ideal para tomarse fotos.""",México,Español,PC,2013-12-26,positivo
Femenino,30.0,Nacional,Excelente,5,59,"""Excelente""","""La verdad muy bonito, me encantó verlo y es increíble la arquitectura y a su alrededor el parque que esta muy limpio y muy bonito, sin duda espero volver pronto a Guanajuato y volver a disfrutar de este bellísimo lugar.""",México,Español,PC,2013-12-14,positivo
Masculino,22.0,Nacional,Excelente,5,26,"""¡IMPONENTE!""","""Un edificio arquitectónico maravilloso, podría verlo mil veces y siempre le encontraría algo de extraordinario.""",México,Español,PC,2013-12-14,positivo
Femenino,50.0,Nacional,Excelente,5,79,"""Orgullo de México""","""Representa una gran época de nuestra historia. Se recomienda entrar con el guía quien explica en forma muy amena e interesante todo lo que representa el teatro, cómo fué construído, por qué y por quién.""",México,Español,PC,2013-12-08,positivo
Masculino,36.0,Internacional,Excelente,5,114,"""Bellísimo. Vale la pena""","""Uno de los teatros que Porfirio Díaz hizo construir y que inauguró meses antes de la Revolución. Decoración fastuosa y a la vez muy mexicana. Suele haber espectáculos gratuitos. Estén atentos, que basta ponerse en fila, pero antes recoger el boleto en la ventanilla.""",Perú,Español,PC,2013-12-07,positivo
Masculino,30.0,Internacional,Excelente,5,15,"""A stunning theater""","""Visitamos para una visita autoguiada y, aunque no tomó mucho tiempo, nos sentamos entre la audiencia y absorbimos la atmósfera. Es un lugar muy hermoso e impresionante y realmente deberías tomarte tu tiempo y disfrutar de la majestuosidad"". ""Mientras estábamos allí, un grupo comenzó a ensayar en el escenario, lo cual fue interesante porque el escenario es enormemente profundo. Quedé realmente impresionado, vale la pena una buena hora sin una obra de teatro, hubiera sido muy divertido atrapar a un actuación, pero nuestra visita fue demasiado corta para exprimirla"".",Estados Unidos,Inglés,PC,2013-11-29,positivo
Masculino,29.0,Internacional,Excelente,5,69,"""MARAVILLOSO""","""Este es el principal teatro de la ciudad. La mejor manera de saber que está viendo una obra de teatro en el mismo, y la mejor oportunidad para esto es durante el festival Cevantino que tiene lugar en octubre. Vi una ópera sobre ella a un precio asequible en comparación con los precios en Brasil. Dado que el espacio es grande, compré el billete el día antes sin problemas. Este es uno de los lugares que sólo pueden ser visitados en Guanajuato.""",Brasil,Portugués,PC,2013-11-25,positivo
Femenino,19.0,Nacional,Excelente,5,19,"""Impresionante""","""El interior es más bello que el de Bellas Artes, se que es dudoso, pero vale la pena verlo. Nunca he entrado a función pero me gustaría saber su acústica y su campo de visión.""",México,Español,PC,2013-11-24,positivo
Femenino,37.0,Internacional,Excelente,5,55,"""Do not miss this stunning beauty""","""Tómese el tiempo y deténgase en este edificio increíblemente hermoso. La arquitectura es deslumbrante. Mientras visitábamos, los actores estaban practicando para una obra futura. No tuvieron ningún problema con nosotros y algunos otros viendo su práctica. Tomamos algunas fotos increíbles de el centro simplemente parado en la parte superior de las escaleras"".",Estados Unidos,Inglés,PC,2013-11-20,positivo
Masculino,42.0,Nacional,Excelente,5,3,"""EXCELENTE SERVICIO""","""Todos los museos están bien organizados, realmente tienen una coordinación de sus recorridos guiados en cualquiera de ellos, se disfruta de la misterioso del lugar y las momias con su galería. En verdad recomiendo esta fabulosa ciudad.""",México,Español,PC,2013-11-19,positivo
Masculino,67.0,Nacional,Excelente,5,69,"""Hermoso sitio y bien cuidado""","""Al llegar al centro turístico los espacios y calles son peatonales, complicado el estacionamiento para el vehículo propio, sin embargo se compensa por lo mucho que hay que ver y conocer: el teatro Juárez es una joya y se utiliza para eventos culturales, muchos visitantes se descansan en las escaleras, se toman la foto, comen golosinas, etc. Tiene un horario de visitas o por ser vacaciones a la hora de la comida estuvo cerrado. Sólo con las fotos de venta nos conformamos. La zona tiene muchos servicios de restaurant, en el jardín hay venta de golosinas, recuerdos y golosinas.""",México,Español,PC,2013-11-17,positivo
Masculino,26.0,Internacional,Muy bueno,4,175,"""Imponente""","""Disfrutando de la arquitectura europea influencias imaginaba lo emocionante que sería ver un espectáculo en este teatro, que por desgracia no tienen la oportunidad de presenciar. Pero vale la pena hacer una visita turística, donde se puede ver que el teatro es la acústica bellos y fantásticos. Si no fuera posible ver una atracción, todavía se puede ser testigo de la fachada varias artista callejero externo que le dan una buena risa.""",Brasil,Portugués,PC,2013-11-15,positivo
Femenino,21.0,Nacional,Muy bueno,4,9,"""Hermoso teatro""","""Quedé maravillada por la arquitectura de este lugar y el interior es una de las maravillas de esta hermosa ciudad que no se puede dejar pasar.""",México,Español,PC,2013-11-12,positivo
Femenino,30.0,Internacional,Muy bueno,4,183,"""Atracción fresca""","""El Teatro Juárez es super hermoso, es una de las principales atracciones de Guanajuato. Incluso si no ir a ver algo que no vale la pena, al menos, tomar una foto en la fachada.""",Brasil,Portugués,PC,2013-11-06,positivo
Femenino,46.0,Nacional,Excelente,5,186,"""Punto de reunión. Más que hermoso""","""Lugar con magia e historia, arquitectura hermosa. Un must en Guanajuato. Todas las tardes en las escaleras de la entrada un mimo convoca y amenaza.""",México,Español,PC,2013-11-04,positivo
Femenino,41.0,Nacional,Excelente,5,4,"""Presente con grandeza del pasado""","""Falta en el área de mezanine una muestra fotográfica-museográfica de la historia y los eventos sobresalientes del teatro. Igualmente la venta de souveniers de alta calidad como playeras, separadores de libros, bibliografia. Posters coleccionables del cervantino, etc.""",México,Español,PC,2013-11-04,positivo
Femenino,53.0,Internacional,Excelente,5,1321,"""Debe ser maravillosa""","""Por desgracia no he tenido la oportunidad de ver un espectáculo en este teatro, lo único que hizo la visita turística, pero he amado todo lo que vi.""",Brasil,Portugués,PC,2013-10-29,positivo
Femenino,33.0,Internacional,Muy bueno,4,357,"""¡Divino!""","""En la ciudad donde todos los años se hace el Festival de Teatros, este es un lugar al que hay que ir si o si. Super bien conservado es un lugar lindisimo para visitar.""",Argentina,Español,PC,2013-10-23,positivo
Masculino,31.0,Internacional,Excelente,5,56,"""Brilliant!""","""Asegúrate de visitar este espectacular teatro. Lo más destacado del viaje. Hermoso por dentro, si puedes ver un espectáculo allí, ¡hazlo!""",Inglaterra,Inglés,PC,2013-10-20,positivo
Masculino,58.0,Internacional,Excelente,5,147,"""Stunning""","""Este es un teatro monumental. Trate de visitarlo durante una función para mejorar su apreciación del sitio"".",Estados Unidos,Inglés,PC,2013-10-19,positivo
Masculino,67.0,Internacional,Excelente,5,33,"""Ballet Flamenco de Zacatecas""","""Al igual que el teatro, como el ballet. lugares libres casi no era, casi no encontraron un asiento en el cuarto nivel.""",Rusia,Ruso,PC,2013-10-17,positivo
Masculino,40.0,Nacional,Muy bueno,4,9,"""Tradicional e imperdibles""","""El edificio es una joya de la ciudad, por el día puedes entrar para hacer recorridos y por las noches normalmente hay conciertos o algunas funciones de teatro. Además de su importancia para el turismo, es un sitio de encuentro para todos los habitantes de la ciudad así que siempre está muy animado, sobre todo por las noches.""",México,Español,Móvil,2013-10-14,positivo
Masculino,28.0,Internacional,Excelente,5,223,"""Awesome""","""Esto está en el corazón del centro de Guanajuato. Si puedes ir a ver una obra de teatro, el lugar es genial y tiene mucha historia"".",Estados Unidos,Inglés,PC,2013-10-14,positivo
Masculino,53.0,Internacional,Excelente,5,102,"""Beautiful""","""Edificio bien conservado, hermosa construcción, muy interesante por dentro y por fuera. Los detalles son asombrosos.""",Estados Unidos,Inglés,Móvil,2013-10-14,positivo
Masculino,32.0,Internacional,Excelente,5,37,"""¡Buenísimo!""","""No dejar de verlo está muy bueno , vale la pena entrar es como ir al pasado glamoroso que debe de haber tenido. Muy bien cuidado.""",Uruguay,Español,PC,2013-10-14,positivo
Femenino,39.0,Internacional,Muy bueno,4,748,"""Beautiful opera house""","""Sí, tienes que pagar para entrar, pero tienen que mantener el lugar, después de todo. Originalmente para la ópera, el Teatro Juárez ahora alberga muchos eventos musicales y obras de teatro. Puedes sentarte en las sillas originales"". y observe todas las decoraciones impresionantes y los detalles arquitectónicos. Asegúrese de ver los salones para beber separados para hombres y mujeres, así como también los palcos que se usan para las viudas. Ha sido increíblemente cuidado. ¡Hermoso!""",Estados Unidos,Inglés,PC,2013-10-12,positivo
Masculino,21.0,Nacional,Excelente,5,17,"""Visita obligada en Guanajuato""","""Es un lugar increíblemente bello para visitar, su arquitectura y diseño son maravillosos, si tienen oportunidad de acudir a alguno de los espectáculos que se ofrecen no duden en entrar, será una experiencia inolvidable.""",México,Español,PC,2013-10-11,positivo
Femenino,26.0,Nacional,Excelente,5,22,"""Beautiful""","""Hermoso teatro, todo aquí fue diseñado pensando en el lujo. Es solo una de las piezas de arte vivo más invaluables en Guanajuato"".",México,Inglés,PC,2013-10-09,positivo
Masculino,26.0,Nacional,Muy bueno,4,25,"""Muy bonita fachada""","""Me gusto la fachada, pero esta un poco escondido y no puedes sacar fotos de frente debido al espacio que es muy reducido.""",México,Español,PC,2013-10-08,positivo
Femenino,30.0,Nacional,Muy bueno,4,24,"""¡Maravilloso lugar!""","""El Teatro es simplemente asombroso. La arquitectura es muy detallada y puede hasta transportarte a la época en la que fue abierto. Tiene la ventaja de que hay carteles en los que explican cada sala y su decoración, así como su uso. Me quedan ganas de asistir a algún evento, porque solo hicimos el recorrido por los diferentes espacios. Hay algunas fotografías de eventos que se han llevado a cabo ahí desde el comienzo y es impresionante verlas.""",México,Español,PC,2013-10-08,positivo
Masculino,65.0,Internacional,Excelente,5,188,"""Lovely Classic Century old Theatre""","""El exterior es un edificio clásico, podría ser la Corte Suprema de EE. UU.. Un bar agradable. El calor propiamente dicho tiene una gran influencia española, está en buen estado y tiene una acústica excelente. ¡Olvídate de una gira, ve a un concierto!""",Canadá,Inglés,PC,2013-10-05,positivo
Femenino,26.0,Nacional,Excelente,5,4,"""Esta muy bonito pero no entre""","""Caminando lo vez y es impresionante el detalle arquitectónico que tiene pero desafortunadamente no entre.""",México,Español,PC,2013-10-05,positivo
Masculino,34.0,Internacional,Excelente,5,100,"""Awesome""","""Este lugar es increíble. Es un hermoso edificio, cuidadosamente conservado. Están abiertos de 9 a 7 p. m. para los visitantes. Date una vuelta, el funicular a la cima de la colina sale justo detrás del Teatro Juárez"".",Costa Rica,Inglés,PC,2013-10-04,positivo
Masculino,47.0,Internacional,Excelente,5,371,"""Beautiful theatre""","""Este era un teatro de estilo morisco muy hermoso, realmente pequeño y sorprendentemente hermoso por dentro y estatuas geniales en la parte superior exterior"".",Estados Unidos,Inglés,PC,2013-10-01,positivo
Masculino,57.0,Nacional,Excelente,5,3,"""Muy bonito lugar""","""Se pone un ambiente sobre todo por las tardes muy agradable, la gente nativa no es nada negativa y por el contrario tratan al turista de la mejor manera, te hacen sentir como en tu casa.""",México,Español,PC,2013-10-01,positivo
Femenino,32.0,Nacional,Excelente,5,15,"""Excelente""","""Tuve la oportunidad de ir a ese teatro junto con mis compañeras , a disfrutrar una muestra de música de viento , de diferentes municipios de este estado. Son chicos de secundaria y preparatoria... ADEMÁS FUIMOS TESTIGOS de como un chico le pidió a su novia que se casara con ÉL... INCREIBLE.",México,Español,PC,2013-09-28,positivo
Masculino,70.0,Internacional,Excelente,5,44,"""Imperdible""","""Es una joya arquitectónica, muy cuidada y muy bien construída. vale la pena recorrerlo con alguien que los guíe y les comente los detalles del lugar. Desentona (en el mejor sentido) con la ciudad, que mantiene un carácter bastante -dejado-.""",Argentina,Español,PC,2013-09-20,positivo
Femenino,22.0,Internacional,Excelente,5,73,"""Magical""","""Mágico, es la palabra que uso para describir no solo el Teatro Juárez, sino la ciudad de Guanajuato en general, especialmente cuando está todo iluminado por la noche; sin duda es algo espectacular. El teatro se encuentra en el centro de la ciudad y justo en frente del Jardín Unión. En cualquier momento del día, verás mucha gente simplemente sentada en las gradas, las escalinatas, del teatro. Desde adolescentes hasta adultos, hay tanta gente sentada, charlando, pasando tiempo con amigos, y simplemente ver a todos los demás pasar. Es un entorno tan tranquilo y uno de los muchos lugares de reunión excelentes en Guanajuato. El teatro en sí es hermoso, por dentro y por fuera. Había una pequeña tarifa para caminar, pero vale la pena verlo, es tan bellamente decorado y detallado (consulte las fotos).""",Estados Unidos,Inglés,PC,2013-09-18,positivo
Masculino,41.0,Nacional,Excelente,5,25,"""Hermoso por fuera y por dentro. Visita obligada""","""Me encantó, obviamente, su arquitectura. Lo que no me gustó es que te cobran por entrar a visitarlo. Y más si tomas fotos del interior.""",México,Español,PC,2013-09-17,positivo
Femenino,69.0,Nacional,Excelente,5,64,"""Es una maravilla""","""¡Precioso! Nos encantó. Nos gustó toditito aunque casi tuvimos que nadar para llegar. Recomendamos ampliamente todo Guanajuato.""",México,Español,PC,2013-09-17,positivo
Masculino,48.0,Internacional,Excelente,5,57,"""Cuidado. Riesgo de que los ojos se te salgan de las órbitas""","""Ve. Entra. Procura que no se te abran demasiado los ojos al acceder a la sala (es inevitable deslumbrarse). E intenta que alguno de los guías que hay por allí te cuente la historia del Teatro, porque se agradece. (El nuestro hasta nos indicó en qué palco era posible sentarse). No es una visita larga. Pero permanece.""",España,Español,PC,2013-09-16,positivo
Femenino,36.0,Nacional,Muy bueno,4,235,"""Callejoneadas""","""El teatro Juarez está ubicado en el centro de Guanajuato,su edificio es hermoso y no hay que dejar de conocerlo tanto de dia como de noche por su iluminacion. Desde sus escalinatas salen por la noche 20.30hs, las tradicionales callejoneadas, cánticos,anecdotas y chistes componen este espectáculo que mientras transcurre vas recorriendo las callecitas de Guanajuato con su romántica iluminación como también las calles subterráneas.Pasan por el callejón del beso donde si estás en pareja debes tomarte una foto allí mientras se escucha el relato de la leyenda de la historia de amor que allí ocurrió y si estás solo/a siempre alguien se ofrece para acompañarte en la toma. Por todo esto hace de este lugar un paseo nocturno imperdible.""",México,Español,PC,2013-09-15,positivo
Femenino,27.0,Nacional,Excelente,5,55,"""Increíble""","""Simplemente indescriptible, como visitante, después de una jprnada laborar el llegar y simplemente sentarte en las escalinatas a disfrutar la lectura de un buen libro; o como la gente local llama ""Vamos a Juarear"" que simplemente es sentarse en las escalinatas solo o con amigos a ver pasar la gente, disfrutar de los espectáculos o simplemente estar ahí. Sentarse a disfrutar de la vista es muy relajante, frente se tiene el Jardín Union con todos los locales de comida que hay, a la derecha las sombrillas de un café restaurante riquisimo, y a la izquierda el museo Diegino.""",México,Español,PC,2013-09-11,positivo
Masculino,25.0,Nacional,Excelente,5,12,"""Teatro exquisito""","""Simplemente asombroso y estupendo, cuenta con una fachada increíble, y acoge de una manera vital a los presentes, aún así no haya obra en escena, el sólo hecho de pasar frente a él te deslumbra y envuelve con esta maravilla arquitectónica.""",México,Español,PC,2013-09-08,positivo
Masculino,32.0,Nacional,Muy bueno,4,93,"""Hermoso teatro, gran marco para la cultura""","""Es un sitio con una arquitectura maravillosa, aunque por dentro domine un estilo y por fuera otro pero en sí es un teatro espectacular y que además ofrece muchas opciones para la diversión y la cultura. Basta admirarlo para que te transmita un poco de la historia que ha pasado por su escalinata. ¡Y disfrutar de un espectáculo dentro es único!""",México,Español,PC,2013-09-04,positivo
Femenino,39.0,Nacional,Muy bueno,4,14,"""Bello e histórico lugar""","""Es un punto obligado en las visitas a Guanajuato Capital, dentro del teatro te transportas a otra época, nos tocó un muy buen guía que nos dió una explicacion muy detallada y anecdotas sobre el edificio y las personalidades que lo han visitado. Muy recomendable. Lastima que por fuera esté sucio y descuidado. Podrían hacer mejor trabajo en limpieza de la parte exterior.""",México,Español,PC,2013-09-02,positivo
Femenino,28.0,Internacional,Excelente,5,2,"""Simplemente hermoso""","""Muy buena, tiene un problema de no tener sonido, pero entendemos que el edificio es antiguo. ¡Nos gusta mucho!""",Brasil,Portugués,PC,2013-09-01,positivo
Femenino,53.0,Nacional,Excelente,5,3,"""Excelente vacaciones en Guanajuato""","""Guanajuato es precioso por la arquitectura las iglesias en cada esquina hay una y todas son preciosas en el Teatro Juárez es la mejor ubicación ya que de ahí parten la callejoneadas.""",México,Español,PC,2013-08-29,positivo
Masculino,37.0,Nacional,Excelente,5,9,"""Bonito""","""Esta muy padre, deberían dejar que la gente toque música por las calles, tiene un clima muy cultural la ciudad.""",México,Español,PC,2013-08-28,positivo
Femenino,17.0,Internacional,Muy bueno,4,24,"""Beautiful""","""Me encanta la arquitectura. No pudimos entrar, ¡esperemos que la próxima vez! Está ubicado frente a una bonita plaza llena de árboles y un restaurante. ¡Intenta ir a una presentación!""",Estados Unidos,Inglés,PC,2013-08-25,positivo
Masculino,58.0,Nacional,Muy bueno,4,8,"""Espectacular""","""No soy un conocedor de estilos de arquitectura, pero a simple vista se puede ver que esta espectacular, es muy bonito y sobre todo tenerlo tan cerca para poder apreciarlo, es especial en el interior, sentarte e imaginarte cuantas y cuantas historias hay dentro de este teatro. Simplemente espectacular y sobre todo engalanado con la bella Ciudad de Guanajuato. Ojo Si Vas con tus bebes y cuentan con tarjetas de estudiante en una de esas y la entrada es gratis, como es visto en este tipo de atracciones históricas.""",México,Español,PC,2013-08-20,positivo
Femenino,66.0,Internacional,Excelente,5,54,"""Belleza extrema""","""El teatro es extraordinaria! abundante y asombrosa belleza. Increíble cómo hermosas permanece hasta el día.""",Portugal,Portugués,PC,2013-08-17,positivo
Masculino,,Nacional,Excelente,5,17,"""Historia y arte""","""Hablar del Teatro Juarez es hablar de historia, arte y tradición, el edificio es construido durante el gobierno del general Porfirio Díaz, el cual con su afán de afrancesar la cuidad manda a edificar este gran teatro, ha un inicio la gente del lugar no acepto este teatro, con relación a su arquitectura es simplemente genial, cuenta con columnas dóricas, jónicas las cuales sostienen por lo alto a las bellas artes. En el pórtico podrás encontrar dos grandes leones de bronce, obra de Jesus F. Contreras, Durante el Festival Internacional Cervantino arropa grandes concierto y obras teatrales, es un placer y un deleite estar entre sus butacas de madera y admirar su gran candil. Este gran edificio debe de estar en tu lista de lugares a visitar en tu vida.""",México,Español,PC,2013-08-14,positivo
Masculino,45.0,Nacional,Muy bueno,4,22,"""Edificio hermoso""","""Me gustó mucho su arquitectura, el mobiliario. La cercanía al Museo de Don Quijote de la Mancha y diversos puntos de interés.""",México,Español,PC,2013-08-05,positivo
Femenino,51.0,Nacional,Excelente,5,5,"""Un bello edificio""","""El edificio esta en el centro de la ciudad, vale la pena entrar, no solo admirarlo por fuera. Es un edificio del año 1903 centro de manifestaciones artísticas, en la construcción de este proyecto trabajaron los mejores artistas del país.""",México,Español,PC,2013-08-05,positivo
Masculino,32.0,Nacional,Excelente,5,20,"""Simplemente hermoso""","""Cada vez que estoy en Guanajuato es un placer admirar este bella edificación, una foto obligada en tu visita a guanajuato,, a un costado a la derecha esta el museo del quijote y enfrente de este teatro hay una casa de dulces tipicos genial! perfectos souvenirs y sube a la 2da planta o come enfrente en valades.""",México,Español,PC,2013-08-03,positivo
Masculino,33.0,Internacional,Excelente,5,121,"""Teatro más hermoso que he visitado personalmente""","""Búsqueda, que mezcla la arquitectura a través de diversas influencias europeas, lindísimo el interior, incluso impecable, vi un par de shows y no sabía si miraba el espectáculo o admirar la belleza de ella, no hay palabras, sólo de verlo. Parada obligatoria para cualquier turista en Guanajuato.""",Brasil,Portugués,PC,2013-07-27,positivo
Masculino,46.0,Internacional,Excelente,5,5,"""Excelente teatro""","""Si van a Guanajuato, no duden en entrar a visitar este teatro. Merece la pena. Es una visita estupenda.""",Estados Unidos,Español,PC,2013-07-23,positivo
Femenino,44.0,Nacional,Excelente,5,12,"""Visita obligada""","""Es un lugar donde muchas personas locales y turistas se sientan en los escalones de la entrada a tomarse fotos y pasar la tarde apreciando a mimos (muy simpáticos) y actores callejeros, tiene una arquitectura muy bonita y conservada que vale mucho la pena observar detalladamente.""",México,Español,PC,2013-07-23,positivo
Femenino,30.0,Nacional,Muy bueno,4,20,"""Lugar hermoso pero paga uno por ver sin aprender del lugar""","""Es un lugar emblematico, hermosisimo. Sin embargo se me hace un exceso que cobren la entrada por ver nada, no hay guías, ni algun letrero que te relate algo sobre el lugar (arquitectura, diseño, muebles, etc)""",México,Español,PC,2013-07-22,positivo
