Femenino,26.0,Nacional,Regular,3,86,"""Bonito pero hasta ahí""","""Para ser la principal atracción o al menos ser catalogada así esperas más, es un teatro inagurado por Porfirio Diaz el cual es muy bonito el interior es mas hermoso pero solo te dejan acceder a la zona de planta baja..tres minutos y ya esta completada tu visita... Cobran 35 pesos así que si vas sólo o en pareja esta bien pero si vas con mas familia no creo que valga la pena y no por los 35 pesos si no por que no hay mucho que ver... no puedes estar 20 o 30 min sentado viendo el escenario o el techo o admirando las alfombras.""",México,Español,Móvil,2015-08-14,neutral
Femenino,25.0,Internacional,Excelente,5,126,"""Hermoso""","""¡Hermoso! Frente a la plaza principal de la ciudad, con una impresionante iluminación y presentaciones externas de los artistas independientes.""",Brasil,Portugués,PC,2015-08-13,positivo
Masculino,51.0,Internacional,Excelente,5,12,"""¡Fantástico!""","""¡Es un viaje histórico que vale totalmente la pena! ¡Observar la arquitectura y los muebles de la época es fantástico! Recomendable""",Estados Unidos,Español,Móvil,2015-08-12,positivo
Masculino,52.0,Internacional,Excelente,5,742,"""One of the great mexican public buildings""","""Dedicado a principios del siglo XX por nada menos que el mismo Porfirio Díaz, el Teatro Juárez, junto con Bellas Artes en la Ciudad de México, sigue siendo uno de los grandes edificios de la Belle Epoque del país. Todavía en uso como cine y teatro en vivo. , el Juárez es una joya bien conservada de una era pasada, cuya opulencia apenas desvanecida evoca vívidos recuerdos de una edad dorada. Vale la pena pagar la tarifa de entrada mínima para recorrer tanto el interior del teatro como sus opulentos salones, repletos de lujoso terciopelo rojo y goteando con atavíos dorados. El bar del vestíbulo es un gran lugar para tomar una copa y ver el paseo de la sociedad en las noches de apertura"".",Estados Unidos,Inglés,PC,2015-08-11,positivo
Masculino,60.0,Internacional,Muy bueno,4,61,"""Edificio icónico""","""El teatro Juárez se impone majestuosamente y es un punto importante en la ciudad donde se arremolinan tanto turistas como vendedores, artistas callejeros y desee luego la estudiantina A un costado encuentras pósters de cuadros de pinturas famosas.""",Venezuela,Español,Móvil,2015-08-10,positivo
Masculino,60.0,Internacional,Excelente,5,475,"""A very happening place""","""Este teatro es una visita obligada. Hermoso edificio por fuera y exhibiciones increíblemente hermosas por dentro. Muchos artistas exhiben sus artes en los escalones del teatro, así como muchas bandas de mariachis actúan allí durante toda la noche"".",Estados Unidos,Inglés,Móvil,2015-08-09,positivo
Masculino,63.0,Nacional,Excelente,5,15,"""¡Fantástico!""","""Un maravilloso lugar, perfecto para obras, conciertos de cámara, trova, CINE con unos hermosos cuartos de baile, salas de estar, camerinos, diseño hermoso, en general, recomiedo que te adentres a los pasillos del lugar, no lo dejes de largo, cuando vayas a Guanajuato, ¡Visitálo!""",México,Español,PC,2015-08-09,positivo
Masculino,32.0,Internacional,Muy bueno,4,366,"""Stunning theatre""","""Es difícil pasar por alto este edificio, ya que es lo primero que llama la atención cuando ingresas a esta pequeña plaza. Los grandes pilares que sostienen el balcón superior realmente le dan al exterior del teatro un aspecto impresionante. Como había una tarifa de entrada y yo quería gastar mi dinero en otra cosa, nunca entré al teatro. Hay guías afuera esperando para guiarlo a través del edificio"".",Suecia,Inglés,PC,2015-08-04,positivo
Masculino,26.0,Internacional,Excelente,5,81,"""Lovely""","""No te pierdas el edificio más asombroso de Guanajuato. Por la noche, los artistas y músicos hacen que el frente esté muy lleno y ¡Vive!""",Brasil,Inglés,Móvil,2015-08-01,positivo
Masculino,57.0,Nacional,Excelente,5,50,"""Beautiful Theatre""","""Hermosa arquitectura y por dentro es simplemente increíble. Tómese su tiempo para caminar o sentarse en el salón principal y disfrutar del increíble entorno y la decoración. Esta es una vista imperdible cuando visite Guanajuato. Debe ser la o una de las más impresionantes teatros en México y posiblemente en América del Norte"".",México,Inglés,PC,2015-07-29,positivo
Masculino,21.0,Nacional,Excelente,5,42,"""Mi edificio favorito""","""El interior como el exterior es maravilloso además de la acústica, en pleno centro de la ciudad es un sitio perfecto.""",México,Español,PC,2015-07-29,positivo
Femenino,19.0,Nacional,Excelente,5,56,"""Fenomenal""","""Aunque sólo pude verlo desde fuera ya que estaba el festival de cine es una construcción bellísima, evita perderte esta visita.""",México,Español,Móvil,2015-07-28,positivo
Femenino,47.0,Nacional,Excelente,5,30,"""¡Imponente y bello!""","""Bella arquitectura y diseño perfecto. La primera vez que lo ves te impone pero en el trayecto que lo vas recorriendo te puedes encontrar con detalles finos y delicados como las figurillas en la parte superior de la edificación.""",México,Español,Móvil,2015-07-28,positivo
Masculino,64.0,Internacional,Regular,3,340,"""Muy buen teatro, pero visita no gratuita y sin ningún tipo de mejora""","""De hecho en el interior del teatro es precioso y ha conservado todo su aspecto hermoso pero nada se destaca por un mínimo de paneles explicativos; de lo contrario el acceso está limitado a una pequeña parte de la sala de teatro de entrada y den y sala de estar en la primera planta para el resto, será mirar hacia otro lado o no sigue las instrucciones que algunos locales. Pagué 35 pesos para la entrada más 30 pesos cuadros a la derecha, se me hace un poco caro para la calidad de la visita.""",Francia,Francés,PC,2015-07-26,neutral
Femenino,65.0,Internacional,Excelente,5,125,"""Impresionante exterior y el interior""","""Es el edificio más imponente de todo el centro histórico. Sus casas escalera turistas descansando viajes largos mientras ve increíbles espectáculos, simplemente espectacular artistas de la calle. Hemos sido testigos de la actuación de un payaso que nos encantó a más de una hora. Entramos y oímos la guía de describir toda la historia del teatro, teniendo en cada habitación. ¡Fue muy bueno!""",Brasil,Portugués,PC,2015-07-26,positivo
Masculino,59.0,Nacional,Excelente,5,265,"""Maravilloso lugar, no deben perdérselo los viajeros de Guanajuato""","""Es un lugar fenomenal que sólo ver la arquitectura exterior vale la pena. Uno de los lugares icónicos de Guanajuato que no deben perderse quienes visitan esta maravillosa ciudad.""",México,Español,PC,2015-07-26,positivo
Femenino,41.0,Internacional,Muy bueno,4,10,"""¡Muy bueno!""","""¡Super lindo! Merece la pena entrar a conocerlo. Hay guías que te cuentan la historia y dan un recorrido por el interior.""",Argentina,Español,PC,2015-07-17,positivo
Femenino,33.0,Internacional,Regular,3,22,"""It's beautiful! But after 6 pm is great""","""Después de las cinco (no estoy seguro de con qué frecuencia) se reúne una gran multitud para ver una actuación de mimo frente al teatro"".",Estados Unidos,Inglés,Móvil,2015-07-16,neutral
Femenino,34.0,Internacional,Muy bueno,4,38,"""Beautiful architecture""","""Solo pudimos ver el salón y el escenario, pero eso fue suficiente para disfrutar del estilo de la decoración, que es bastante impresionante. También puedes ver los ensayos, si es que hay uno"".",Alemania,Inglés,PC,2015-07-15,positivo
Femenino,23.0,Nacional,Excelente,5,20,"""Arquitectura perfecta""","""Uno de los atractivos más importante de la única Ciudad de Guanajuato, es un lugar lleno de magia, su arquitectura es magnifica.
Puedes realizar los recorridos por tu cuenta o bien contratar a un guía que te lleve a otra época e imagines ser parte de ella. Además que a un costado de dicho lugar se encuentra un restaurante tipo gourmet muy bueno, teniendo como vista el hermoso Teatro Juárez.""",México,Español,PC,2015-07-15,positivo
Femenino,48.0,Internacional,Muy bueno,4,343,"""Stop to see this""","""Este es un teatro hermoso y ornamentado. Incluso si no te tomas unos minutos para mirar adentro, debes tomarte unos minutos para admirar su estilo y construcción afuera. Está en la zona central y es difícil pasarlo por alto. la gigantesca Universidad de Guanajuato"".",Estados Unidos,Inglés,Móvil,2015-07-14,positivo
Femenino,38.0,Internacional,Muy bueno,4,142,"""Icono de Guanajuato""","""Precioso edificio ubicado en la parte más importante de la ciudad, frente al Jardín Union. Reamente muy bien conservado. Para visitarlo por dentro hay que pagar $ 35.""",Argentina,Español,PC,2015-07-12,positivo
Femenino,48.0,Nacional,Excelente,5,75,"""Hermoso teatro Juárez en Guanajuato""","""Muy hermoso el teatro que presenta eventos importantes ubicado en el centro del pueblo es el punto de reunión de las Tunas que deleitan con su música y alegría a los visitantes, su estilo elegante y antiguo. No puedes dejar de conocerlo.""",México,Español,PC,2015-07-11,positivo
Femenino,54.0,Nacional,Excelente,5,6,"""¡Precioso!""","""Vale mucho la pena. Una joya de la arquitectura del porfiriato (1903). Ícono y referencia de la capital del Estado de Guanajuato. Los eventos del Cervantino lucen muchísimo y la acústica es estupenda. Hay visitas guiadas.""",México,Español,PC,2015-07-09,positivo
Masculino,66.0,Nacional,Excelente,5,12,"""El mejor teatro de la era porfiriana""","""Esta es una edificación porfiriana impresionante y fastuosa, entrar te transporta a una época llena de lujos, desde el exterior con sus musas, hasta los más mínimos detalles en el interior te deslumbraran por su opulencia, vale lo que te cobra y vale tomarle fotos, es simplemente una obra arquitectonica mexicana sin igual.""",México,Español,PC,2015-07-08,positivo
Femenino,56.0,Internacional,Excelente,5,812,"""Hermoso edificio""","""Edificio hermoso teatro con esculturas de la fachada se coloca cerca de la Unión jardín público, vivíamos en un hotel no lejos de ella. Fue construido en el borde de los siglos 19 y 20, cuando la ciudad comenzó en la minas de entrada de capital extranjero. Especialmente hermoso edificio en las luces de la tarde. Por desgracia, para llegar a la obra no era posible, ya que había en la ciudad por sólo un día.""",Rusia,Ruso,PC,2015-07-03,positivo
Masculino,63.0,Internacional,Regular,3,834,"""Es un espléndido edificio""","""Hay en la entrada de la estación del teleférico a la Pípila de la colina. Aquí siempre, la jaula es más de artistas callejeros, deleite. En este pueblo rural, el hecho de que un teatro tan respetable allí, una vez, me gustaría para simbolizar que esta ciudad había sido humedecido por la extracción de plata.""",Japón,Japonés,PC,2015-06-30,neutral
Masculino,45.0,Internacional,Muy bueno,4,87,"""Bonito aunque sólo el exterior""","""Un lugar tradicional en el corazón del centro histórico de Guanajuato, muy bello de contemplar; desafortunadamente solo se puede visitar el exterior.""",Perú,Español,Móvil,2015-06-27,positivo
Femenino,27.0,Nacional,Excelente,5,14,"""Hermoso""","""El lugar es hermoso, definitivamente un lugar obligado si se visita Guanajuato. Los lunes no abren, tomen sus precauciones, la visita nocturna es muy bonita.""",México,Español,Móvil,2015-06-16,positivo
Femenino,57.0,Nacional,Excelente,5,15,"""Increíble, lo mejor de Guanajuato""","""Definitivamente vale la pena verlo, la entrada incluye un tour guiado por un historiador, muy interesante.""",México,Español,PC,2015-06-12,positivo
Femenino,30.0,Nacional,Muy bueno,4,16,"""Bonito por fuera""","""Está muy bonito por fuera pero no pudimos ingresar al interior y le falta un poco más de leyenda para hacerla más interesante.""",México,Español,PC,2015-06-09,positivo
Masculino,50.0,Internacional,Excelente,5,14,"""Hermoso lugar""","""Quedarás impresionado con la belleza de este teatro… tienes que conocerlo para que puedas disfrutar lo hermoso que es.... te hace sentir como que estas en esa época que fue construido. Impresionante.""",Estados Unidos,Español,PC,2015-06-05,positivo
Masculino,64.0,Internacional,Excelente,5,371,"""Es una ciudad que desea visitar por todos los medios""","""Se ha referido como ciudad universitaria, la escala de las ruinas de las minas de plata de la colonia es la elegante ciudad no demasiado grande. Hill son muchos, pero el tráfico de autobuses tienen venas traza se convierte en la carretera principal se ha desarrollado. Desde el Teatro en la Plaza, el más reciente es exuda una atmósfera solemne, que es grande si usted es partido y el paisaje de la ciudad.""",Japón,Japonés,PC,2015-06-04,positivo
Femenino,44.0,Nacional,Excelente,5,24,"""Un lugar imperdible en Guanajuato…""","""Tantas veces visitando la ciudad y nunca me había dado el tiempo de entrar al teatro, hasta el pasado 14 de febrero. Nos encantó a mi esposo y a mí, es un lugar que se admira desde afuera y adentro wow, saber que guarda tanta historia. Siempre te encontraras personajes que te contarán la historia del teatro y x supuesto poniéndole mucho de su cosecha, pero igual durante su plática te hacen pasar un buen rato, ya es cuestión personal que creer y que no de todo lo que te cuentan.""",México,Español,Móvil,2015-06-03,positivo
Masculino,40.0,Nacional,Excelente,5,6,"""Un mundo que descubrir""","""Un teatro que me ha dejado sin palabras, toda la historia que guarda y sobre todo la belleza de sus muros y de su escenario.""",México,Español,PC,2015-06-02,positivo
Masculino,26.0,Nacional,Excelente,5,29,"""Hermoso lugar""","""Sin duda uno de los lugares más hermosos de la ciudad de Guanajuato, por la noche la iluminación lo hace ver aun mas bonito, durante la tarde en la escalera de la entrada un mimo se encarga de hacer reír a la gente con un show muy cómico un lugar muy bonito.""",México,Español,Móvil,2015-06-01,positivo
Masculino,64.0,Nacional,Excelente,5,53,"""Bellísimo""","""La arquitectura de este museo es bellísima, el museo es parte importante de esta ciudad y un excelente complemento.""",México,Español,PC,2015-05-28,positivo
Femenino,33.0,Internacional,Excelente,5,32,"""Viaje a través del tiempo""","""Cuando entras en el antiguo teatro uno se siente transportado directamente a otro tiempo.Todo se ha conservado bien, los interiores, asientos, pasillos, escaleras. Se puede imaginar exactamente cómo solía ser la derecha se ha celebrado. ¡Vale la pena!""",Bélgica,Alemán,PC,2015-05-20,positivo
Femenino,24.0,Internacional,Excelente,5,30,"""Hermoso""","""Si te gustan los museos, no debes dejar de visitar este, debes tener en cuenta que para ir debes pagar tu entrada y ademas un derecho adicional por usar tu camara dentro del museo, además de ver su estructura que es hermosa debes visitarlo con algun programa cultural, quedarán maravillado de verlo en funcionamiento, con todas las luces iluminando algun artista o presentacion folclórica.""",Chile,Español,PC,2015-05-18,positivo
Masculino,36.0,Nacional,Regular,3,71,"""Clásico""","""Me agrada que la construcción esta hecha a lo que es la ciudad colonial, me parece de buen tamaño. Aunque no me agrada las butacas, me parecen un poco incomódas para los eventos de más de una hora.""",México,Español,PC,2015-04-30,neutral
Femenino,39.0,Internacional,Muy bueno,4,37,"""Do take a look""","""Nos decepcionó que solo se pueda entrar a un área restringida en el teatro principal y a la sala de 'fumadores' en el piso de arriba, pero definitivamente vale la pena verlo, está muy ornamentado. Solo toma unos minutos mirar alrededor"".",España,Inglés,PC,2015-04-23,positivo
Femenino,29.0,Nacional,Excelente,5,58,"""Muy hermoso""","""La arquitectura que rodea sus paredes es bellísima, tienes que estar ahí para poder admirarlo a lo grande, guanajuato es una ciudad hermosa, tienes que recorrer cada uno de sus callejones para llenarte de su historia.""",México,Español,PC,2015-04-23,positivo
Masculino,45.0,Nacional,Regular,3,161,"""Beautiful Theatre but limited access when touring inside""","""Hermoso teatro desde el exterior, pero cuando fuimos a recorrer el interior, los pisos superiores estaban cerrados y bloqueados. Pudimos ver el escenario desde el área de asientos principal, pero no pudimos ver todo el teatro y los niveles superiores. probablemente tenga una mejor experiencia yendo a una actuación"".",México,Inglés,PC,2015-04-21,neutral
Femenino,33.0,Nacional,Excelente,5,115,"""Hermoso""","""El lugar es bellísimo tanto por fuera como por dentro, lo tienen súper bien cuidado, por la parte de adentro no se puede accesar a todos lados pero no hace falta, sin duda una parada obligada en este lugar.""",México,Español,PC,2015-04-13,positivo
Masculino,37.0,Nacional,Excelente,5,537,"""Excelente arquitectura""","""Por fuera majestuoso y muy bonito. Por dentro esta bonito pero no tanto como por fuera. Aparte que sóo se puede entrar a pocos puntos (muchos puntos están cerrados).""",México,Español,Móvil,2015-04-06,positivo
Masculino,46.0,Nacional,Excelente,5,278,"""Impresionante""","""Es un lugar imperdible si visitas Guanajuato, fue inaugurado a principios del siglo pasado por Don Porfirio Díaz, la elegancia y clase del teatro es admirable.""",México,Español,PC,2015-04-06,positivo
Femenino,18.0,Nacional,Excelente,5,39,"""Hermoso de día y de noche""","""Aunque no entre por fuera es bellísimo y de noche lo es aún más, ahí afuera empieza la callejoneada creo que tenía que haber entrado.""",México,Español,Móvil,2015-04-04,positivo
Masculino,32.0,Internacional,Regular,3,1498,"""Muy ocupado""","""Si desde la ciudad de escala es un teatro de lujo de gran parte desproporcionada. Teatro antes de las escaleras a menudo artistas de la calle siempre llenos de gente tiene los títulos de los huéspedes. Las palabras no saben, pero me gustó sólo mirar porque es sobre-reacción de ciertos baile.""",Japón,Japonés,PC,2015-04-02,neutral
Masculino,50.0,Internacional,Excelente,5,403,"""Lleno de gente escaleras""","""También lleno de gente día y noche, es el centro de la ciudad. Muy juntos Para sentarse a una persona para escaleras. El tiempo que he dicho siempre algunas personas, tales como el payaso, tenía reír personas. Los estudiantes que se llama ser en esta zona por la noche es-a-Dian Latina (Serenade orquesta) es, donde incluso de mí una actuación divertida mientras se reproduce una noche en la ciudad apareció fuera, es muy divertido y memorable.""",Japón,Japonés,PC,2015-03-25,positivo
Femenino,25.0,Internacional,Excelente,5,64,"""Must GO""","""Este es uno de los teatros coloniales más fascinantes que verás. Bellamente conservado, al entrar puedes ver cuán bellamente construido está. Hay guías en el lugar que con gusto te llevarán por el teatro y te explicarán su hermosa historia por un pequeño propina, así que por favor sé amable con ellos ya que esta es su principal fuente de ingresos. La arquitectura es impresionante, te lleva atrás en el tiempo más de cien años. No te pierdas esto, no te arrepentirás, toma muchas fotos, teatros como esto no se ve a menudo"".",Estados Unidos,Inglés,PC,2015-03-21,positivo
Masculino,30.0,Nacional,Excelente,5,43,"""¡Joya arquitectonica!""","""Es un verdadero orgullo como Mexicano tener lugares como el teatro Juárez, una verdadera joya arquitectónica. Sentarse en su escalinata mientras la gente pasa es una de esas pequeñas cosas de la vida que le dan sabor. Un ""must"" si viajan a Guanajuato.""",México,Español,PC,2015-03-13,positivo
Femenino,55.0,Nacional,Muy bueno,4,131,"""Art Deco style theater, multi-venue""","“Si estás en Gto., es muy posible que encuentres algún evento al que asistir en el Teatro Principal. Perteneciente a la U. de Gto., es el principal escenario de la Sinfónica de la U.G. y sirve para muchas actividades de cine. durante el festival de cine hasta presentaciones de teatro y música durante el Festival Internacional Cervantino. Ha sido renovado recientemente, el sonido ha mejorado mucho, los asientos son cómodos y hay buenas visuales desde casi cualquier parte del teatro"".",México,Inglés,PC,2015-03-11,positivo
Masculino,41.0,Internacional,Excelente,5,30,"""Must visit""","""Uno de los teatros coloniales más hermosos que he visto. Muy bien mantenido. Bellamente iluminado por la noche"".",Costa Rica,Inglés,PC,2015-03-05,positivo
Masculino,25.0,Nacional,Muy bueno,4,27,"""Un buen teatro universitario""","""Un bonito lugar para visitar, totalmente unviersitario, hay que escuchar la sinfonica univeritaria en este lugar, visita obligada en la ciudad.""",México,Español,PC,2015-03-03,positivo
Masculino,43.0,Internacional,Muy bueno,4,40,"""Muy bonito""","""Este teatro es un icono de Guanajuato, esta en el centro de la ciudad cerca de todo, en la noche es muy bonito ya iluminado.""",Chile,Español,PC,2015-03-02,positivo
Masculino,55.0,Internacional,Excelente,5,187,"""Toda una historia""","""Me gustó mucho visitar el Teatro Juárez de Guanajuato. La arquitectura es impresionante (parecidos a los grandes teatros en otras ciudades latinoamericanas) y la historia que tiene en la vida artística y sobre todo la vida política de México vale la pena.""",Chile,Español,PC,2015-02-27,positivo
Masculino,69.0,Nacional,Excelente,5,11,"""El teatro Juárez es un edificio de inicios de 1900""","""Es un edificio que fue inaugurado por Porfirio diaz, puede ser visitado todos los días de la semana y los días viernes a las 8:00 de la noche hay audición de la orquesta filarmónica de la universidad de Guanajuato a precios muy accesible.""",México,Español,PC,2015-02-19,positivo
Masculino,67.0,Internacional,Muy bueno,4,394,"""A Classic Old Theater - May Need Refurbishing Soon""","“Esto no fue lo primero que visitamos en Guanajuato, pero finalmente hicimos un recorrido. El teatro Juárez tiene más de 100 años y empieza a notarse. Tal vez sería más brillante si asistieras a un evento y estuvieras en la emoción de las luces, la multitud y la gente. Es fácil ver que ha sido un edificio hermoso, pero ahora está un poco desaliñado, como una viuda envejecida. Sin embargo, vale la pena visitarlo"".",Estados Unidos,Inglés,PC,2015-02-18,positivo
Masculino,57.0,Nacional,Excelente,5,90,"""Una joya arquitectónica""","""Después del Teatro de Bellas Artes en la Ciudad de México, el Teatro Juárez en Guanajuato es el segundo más bello y grandioso, no puedes dejar de visitarlo, en la esplanada se presentan: mimos, payasos, etc. dando espectáculos, que por cierto están muy buenos...""",México,Español,PC,2015-02-18,positivo
Masculino,52.0,Nacional,Excelente,5,90,"""Hermoso sitio""","""Definitivamente uno de los lugares obligados a ir a visitar aunque sea por afuera, la arquitectura es maravillosa y el interior es hermoso, un sitio lleno de historia.""",México,Español,PC,2015-02-18,positivo
Masculino,43.0,Nacional,Excelente,5,10,"""Simplemente hermoso""","""Es un lugar hermoso, situado en la zona de mas ambiente, los fines de semana, siempre hay espectáculos callejeros, de verdad tienen que visitar.""",México,Español,Móvil,2015-02-18,positivo
Masculino,28.0,Nacional,Excelente,5,10,"""A turn-of-the century gem""","""Este es un espacio fabuloso. Puedes entrar para mirar alrededor por una pequeña tarifa y te sorprenderás. La arquitectura es absolutamente impresionante. El interior es tan opulento como el exterior. Si puedes, ve a uno de los eventos allí. He visto conciertos de jazz de clase mundial allí por 50 pesos. Tanto como un lugar hermoso como un lugar donde sucede buena música, este es un lugar que no debes perderte"".",México,Inglés,PC,2015-02-17,positivo
Masculino,52.0,Nacional,Muy bueno,4,53,"""Hermoso recinto""","""Situado justo enfrente del Jardín de la Unión, este lugar tiene una fachada muy bonita, y es un lugar de visita obligada para todo turista. Ciertos días hay artistas que realizan actos enfrente del teatro.""",México,Español,PC,2015-02-07,positivo
Masculino,70.0,Internacional,Excelente,5,149,"""A feast for your eyes""","""El teatro fue construido en 1903 y se ha conservado maravillosamente, incluso tiene los asientos originales. Los techos, las paredes, el trabajo de hierro y las ventanas son obras de arte exquisitas. No se pierda la gran antesala (¿recepción?) en el segundo suelo con techo de cristal"".",Estados Unidos,Inglés,PC,2015-02-06,positivo
Masculino,37.0,Internacional,Excelente,5,15,"""Don't leave Gto without a visit to this landmark""","""Posiblemente el centro de Guanajuato, esta obra maestra arquitectónica de 1903 es un lugar de encuentro, un gran lugar para observar a la gente desde una posición elevada en uno de los cafés cercanos, y uno de los edificios más interesantes y fotogénicos de esta pintoresca ciudad colonial. Pero no -- repito, no lo hagas -- vete sin al menos un recorrido por el teatro. Mejor aún, asiste a una presentación. La presentación de la Novena de Beethoven por parte de la Sinfónica de Guanajuato (a principios de diciembre) fue lo más destacado de nuestra visita de dos semanas"".",Estados Unidos,Inglés,PC,2015-02-02,positivo
Femenino,40.0,Internacional,Muy bueno,4,10,"""Un bello teatro""","""Situado en una posición central y cerca de varios otros puntos de interés, el Teatro Juárez impresionado por la arquitectura. No recomendaría hacer una visita al interior del museo. Muchas zonas están cerradas y hay poco que ver, más vale la pena mirar la programación local, porque el teatro es poner en escena frecuencia para presentaciones de músicos mexicanos y compañías de danza regionales.""",Brasil,Portugués,PC,2015-01-31,positivo
